product_id,product_type,review,summarizing
1000165885,한옥집 김치찜 500g,양파 참치 고춧가루 물 추가해서 끓였습니다 두부 추가해서 끓여 먹었어요 구어 먹고 남은 삼겹살 넣고 끓이니 맛있어요 물기 빼지 말고 넣어도 물을 좀 추가해서 끓여야겠더라구요 계란말이나 계란찜해서 같이 드세요 간 조금 더해서 국물 내고 먹어요,"양파, 참치, 고춧가루, 물을 넣고 끓인 후 두부를 추가해 먹으면 좋습니다. 남은 삼겹살을 넣어도 맛이 더해지며, 물기를 빼지 않고 넣어도 괜찮습니다. 국물이 부족할 경우 물을 추가해 끓이세요. 계란말이나 계란찜을 곁들여 먹으면 더욱 맛있습니다. 간을 조금 더해 국물 맛을 조절해 보세요."
1000166176,갈비탕,자주 먹을 생각 간편하게 한 끼 식사로 잘 먹고 있는 갈비탕인데요 갈비찜도 양념장만 넣고 살짝 맛만 들일 정도로 졸이면 정말 맛있겠어요 당면 넣어서 먹으면 좋을 듯 하네요 맛있게 잘 먹고 만족합니다 또 주문해서 먹을 것 같네요 매콤한 걸 좋아해서 청양고추를 넣어 먹었어요 자취생들도 입맛 까다로운 아이가 있는 분들 모두 모두 모이세요 계란으로 지단을 만들어 같이 먹어요 당면 소량을 불려 두었다 같이 넣어 먹어요 파를 쫑쫑 썰어서 마지막에 팍팍 뿌려 파 향을 머금은 맛있는 갈비탕을 먹어요 자주 찾아갈 거 없이 집에서도 간편히 먹을 수 있어 좋아요 꾸밀 것도 없이 가볍게 이쁜 맛있는 한 상차림이 되네요 간편하게 든든한 한 끼 먹을 수 있어서 좋습니다 다른 재료 필요 없이 파만 쓱쓱 썰어 넣으니 해동시키고 대파 좀 넣어서 후추 뿌려서 먹었어요 ㅎ 오늘은 내 해장국으로 한 팩 뜯었습니다 기대해요 저녁에 바로 해 먹으려고 해동시키고 간편하게 몸 보신 좋네요 계란 고명이랑 파만 추가하면 시댁 식구 대접해도 되겠어요 워킹 맘이다 보니 간 편식을 상시 준비 해 놓습니다 한 번 끓여서 먹기만하면 되니 간편하고 구매 추천 마땅한 찬거리가 없거나 비 오고 으스스한 날에 먹기 딱 좋아요 간편하게 조리해서 집에서도 맛있는 갈비탕을 먹을 수 있어 좋습니다,"갈비탕을 간편하게 한 끼 식사로 즐길 수 있습니다. 갈비찜으로 변형할 때는 양념장만 넣고 살짝 졸이면 좋고, 당면을 추가하면 더욱 맛있습니다. 매콤한 맛을 원한다면 청양고추를 넣어보세요. 계란으로 지단을 만들어 함께 먹거나, 파를 썰어 마지막에 뿌리면 파 향이 더해져 맛있습니다. 해동 후 대파와 후추를 추가해 간편하게 즐길 수 있으며, 해장국으로도 적합합니다. 바쁜 일상 속에서도 쉽게 조리할 수 있어 자취생이나 가족 대접에도 좋습니다. 비 오는 날이나 간편한 식사가 필요할 때 안성맞춤입니다."
1000166234,인삼품은 꼬리곰탕,강추추추추 추천 마구 마구 합니다 소꼬리 곰탕은 집에서 끓여 먹기 어려운데 베이스로 ㅡ다양한 요리 가능 추운 겨울이다 보니 식사할 때 주기적으로 탕이 필수라 주문해 보았는데 바쁠 때 간편하게 한 끼 식사로 곁들일 만 했어요 간단히 한 끼 먹기 좋네요 물을 많이 부어서 끓여야 노인들이나 아기들도 줄 수 있는데 간을 취향에 따라 할 수 있도록 따로 보내 주면 더 좋겠어요,"소꼬리 곰탕을 베이스로 다양한 요리를 시도해 보세요. 바쁠 때 간편하게 한 끼 식사로 활용할 수 있습니다. 물을 많이 부어 끓이면 노인이나 아기들도 쉽게 먹을 수 있으며, 간을 취향에 맞게 조절할 수 있도록 따로 제공되면 더욱 좋습니다."
1000176459,고깃집 갈비살 된장찌개,고기랑 어울리는 찌개 탕을 구매하려고 재료 더 넣어 먹었어요 냉장고에  있는 야채 조금 디 넣어 끓인 된장찌개 고기 더 넣고 두부랑 더 넣어서 먹으면 최고 여럿이 먹을 땐 두부나 호박 등 재료 더 추가하면 돼요 펜션 놀러 갈 때 갖고 가서 맛있게 먹었어요 재구매 할 듯 하네요,"냉장고에 있는 야채를 추가하여 된장찌개를 끓이면 더욱 맛있습니다. 고기와 두부, 호박 등을 넣어 여럿이 함께 즐기기 좋습니다. 펜션에서 간편하게 조리해 먹기에도 적합합니다."
1000198908,우거지 감자탕,해동해서 직접 끓여 드시는 것을 추천 드립니다 간편하게 한기 식사로 좋을 것 같습니다 그냥 뜯고 끓이기만하면 되서 너무너무 편했어요 필수 후식 볶음밥을 해 먹었는데 너무 맛있어서 김치 잘게 송송 썰고 참기름과 참깨 날치 알 그리고 마지막으로 김 가루까지 남은 국물은 볶음밥으로 볶아 먹었는데 순 삭 해서 사진이 없음 물을 조금 더 넣어서 끓이니 딱 좋네요 편하게 많이 먹고 싶으면 집에 있는 시래기도 추가로 넣어 먹으면 좋을 거 같습니다 전 국물이 남으면 거기다 바비벼 먹어요 김 가루 넣구요 감자탕은 집에서 해 먹기 쉽지 않은데 이제 외식하지 않아도 맛있는 감자탕을 먹을 수 있겠네요 굳이 배달 안 시켜도 싸고 맛나게 감자탕을 먹을 수 있어서 추천 냉동실에 있던 우거지가 있어서 같이 해동시켜 대파와 마늘 고추가루 더 넣어서 끓인 후 들깨 가루 깻잎 있으면 첨 해서 드세요 훨씬 맛나요 갑자기 식사 준비해야 되거나 저녁 메뉴로 뚝딱 너무 간편해서 좋아요 김치 살짝 썰어 넣어 만드는데 밥에 비벼 먹으면 밥도둑이에요,"해동 후 끓여서 간편하게 한 끼 식사로 즐길 수 있습니다. 김치와 함께 볶음밥을 만들어 먹으면 맛이 좋고, 남은 국물에 볶음밥을 비벼 먹으면 더욱 맛있습니다. 시래기나 대파, 마늘, 고추가루를 추가하면 풍미가 더해져 더욱 맛있게 즐길 수 있습니다. 갑작스러운 식사 준비에도 유용하며, 김치를 썰어 넣어 밥과 함께 비벼 먹으면 밥도둑으로 손색이 없습니다."
1000202745,갈빗살 미역국,변비 있을 때면 찾게 되는 멱 국 숙취에 해장용으로 먹어도 될 꺼 같은 저는 미역국 끓일 때 고기와 미역 볶고 간 하기 전에 물 넣고 끓인 뒤 컬리 양지 육수를 추가해 주니 자기 전에 꺼내 놓으면 아침에 먹기 좋아요 갈 빗살 미역국 베이스로 미역 추가하고 간 좀 더 해서 먹어요 국이 아니라 찌개처럼 건더기 많은 걸 좋아해서 미역 많이 추가합니다 계속 애용하려구용,"변비가 있을 때나 숙취 해소를 원할 때 미역국으로 활용하기 좋습니다. 고기와 미역을 볶은 후 물을 넣고 끓인 다음 육수를 추가하면 더욱 깊은 맛을 느낄 수 있습니다. 아침에 먹기 위해 미리 준비해 두면 간편하고, 미역을 많이 넣어 찌개처럼 건더기가 풍부한 형태로 즐길 수 있습니다."
1000205921,삼계탕 800g,다가오는 복날을 위해 하나 주문했어요 가이드대로 8분 딱 끓였어요 마늘 5 쪽 현미 누룽지 50g 추가했어요 마지막에 닭 덜어 두고 국물에 부추 50g 익혀서 같이 먹었어요 또 먹을 것 같아요 간단하게 영양 보충하고 싶을 때 좋습니다 감자와 대파 넣고 끓이면 죽꺼지 먹으면 딱 맞을 것 같아요 완제품이라 데워 만드시면 간편하게 좋을 꺼 같아서요 복날에 삼계탕을 간단히 조리해서 먹고 싶어서 주문했어요 남은 국물에 죽 끓여 먹었어요 데우기만함 건강식을 먹을 수 있어 넘 편하네요 밥 말아서 잘 먹었어요 먹기 편하고 간단하게 끓여 먹어 퍈해요,마늘과 현미 누룽지를 추가하여 끓이면 더욱 맛있습니다. 국물에 부추를 익혀서 함께 먹으면 영양 보충도 되고 좋습니다. 감자와 대파를 넣어 죽처럼 끓여 먹으면 간편하게 한 끼를 해결할 수 있습니다. 완제품이라 데우기만 하면 되니 복날에 삼계탕을 간단히 조리해 먹기 좋습니다. 남은 국물에 밥을 말아 먹으면 건강식으로도 훌륭합니다.
1000218239,순두부 된장찌개,채소 많이 추가해야 돼요 다음번엔 고추를 꼭 빼고 먹으려고요 야채 더 넣어도 될 듯 짭짤해서 야채 좀 더 넣고 두부 좀 더 넣고 물도 쫌 더 추가해서 먹으니 딱 좋네요 또 사 먹으려고요 캠핑 가서 된장찌개 먹었어요 된장 양념을 반만 넣어 봐야하나 싶기도 김치도 넣어 먹으면 맛있어요 편리해요 밀 키트라서 조리하기가 쉽네요 순두부인데 된장찌개라 해서 궁금해서 사 봤어요 요리 편하고 간편하게 잘 먹습니다 물은 정량보다 조금 더 넣어야해요 손두부 찌게 생각날 때 먹을 만해요 된장 넣고 찌게로 끓여서 먹으니 좋습니다 냉장고에 있는 재료들을 더 넣어 주셔야할 것 같아요 편하긴해요 간편하게 밀 키트로 먹기 딱 좋아요,"채소를 많이 추가하여 더욱 풍부한 맛을 즐길 수 있습니다. 고추는 빼고, 야채와 두부를 더 넣고 물을 조금 추가하면 간편하면서도 맛있는 된장찌개가 됩니다. 캠핑에서도 쉽게 조리할 수 있으며, 김치를 넣으면 더욱 맛있습니다. 밀 키트로 조리하기 간편하니, 냉장고에 있는 재료들을 활용해 보세요. 손두부 찌개가 생각날 때 좋은 선택입니다."
1000218241,김치 순두부찌개,육수 팩도 있어서 좋네요 소세지 썰어 넣고 계란도 넣어서 끓였어요 반 김치찌개 반 부대찌개 반 순 두부찌개 맛 나요 한 끼 먹고 남은 거엔 낼 수제비 넣어 먹어야겠네요 딸이 좋아해서 구매하게 되었어요 김치가 커서 잘라 주었구요 설명서대로 300cc만 넣으세요 멸치 육수 낼 수 있는 거랑 팽이버섯까지 있네요 좋아하는 참치 한 캔 넣었더니 너무 맛있게 먹었어요 편해요 김치 더 넣고 김치 국처럼 끓이면 맛있어요 김치 더 넣어서 끓여도 맛나요 순두부랑 김치와 여러 야채가 들어 있어서 편하게 왔네요,"소세지와 계란을 넣고 끓이면 김치찌개와 부대찌개, 순두부찌개의 맛을 동시에 즐길 수 있습니다. 남은 국물에 수제비를 넣어 먹으면 좋고, 멸치 육수와 팽이버섯을 활용해 깊은 맛을 낼 수 있습니다. 좋아하는 참치 한 캔을 추가하면 더욱 맛있습니다. 김치를 더 넣어 김치 국처럼 끓이면 풍미가 살아납니다. 다양한 야채와 함께 간편하게 조리할 수 있어 편리합니다."
1000220124,대파 닭개장,대파 육개장으로 착각해 주문했네요 언제나 믿고 먹는 엄마 밥상 신제품 아침 국으로 밥과 같이 대파 닭개장이랑 먹으면 맛있을 것 같아 구매했어요 역시 믿고 사는 엄마 밥상 남편이 좋아해요 항상 주문해 먹고 있어요 숙주만 추가해서 먹고 있어요 간편하게 얼큰한 닭개장 한 그릇 할 수 있어 좋더라구요 급할 때 한 끼 식사로 넘 좋아요,대파 닭개장을 밥과 함께 먹으면 맛있습니다. 숙주를 추가하면 더욱 풍성한 맛을 즐길 수 있어요. 간편하게 얼큰한 한 그릇을 만들 수 있어 급할 때 한 끼 식사로 좋습니다.
1000231896,본 뼈없는 갈비탕,재구매해서 아이 아침으로 먹여요 파랑 잡채 면은 따로 준비하세요 무 파 마늘 국간장 조금 맛술 넣고 더 끓여 줬어요 편리하게 먹을 수 있어 좋아요 곤약 면 누 들면 당면 소면 넣고 먹음 너무 맛있네요 팽이 버섯 넣어서 같이 끓여 먹으니 굿 갈비탕은 먹고 싶은데 나가긴 귀찮을 때 딱입니다요 갈비탕 아들이 또 해 달라네요 뼈가 없어서 뒷처리 간편해서 좋았어요 파랑 당면 요런 거 같이 넣어 먹어두 너무 맛있네요 간편하게 먹을 수 있어 아들이 혼자서 뚝딱 데워서 먹네요 간편하게 해 먹을 수 있어 좋네요 아이들 저녁으로 휘리릭 끓여서 줬어요 밥이랑 같이 먹으니 든든해요 끓여 주기만하면 돼서 너무 좋구여 국물을 좋아하는데 날이 더워서 집에서 끊여 먹을 엄두가 나지를 않네요 반주 한잔 하게 되었네요 뼈가 없어서 끓여서 먹기만하면 되니까 간편해서 너무 좋아요 귀찮은 사람들을 위한 제품으로 딱입니다 조리법도 간편하고 아이에게 당면 넣고 밥 말아 주니 한 그릇 뚝딱 하네요 바쁜 아침 늦은 시간 야참으로도ᆢ 뜨끈한 국물이 생각날 때도 굿입니다 당면 버섯 대파 등을 추가하고 후추도 톡톡 기호에 맞게해서 먹었어요,"아이 아침으로 간편하게 활용할 수 있습니다. 파랑 잡채 면을 따로 준비하고, 무, 파, 마늘, 국간장, 맛술을 넣어 끓이면 맛있습니다. 곤약 면과 당면, 소면을 함께 넣어도 좋고, 팽이버섯을 추가하면 더욱 풍미가 살아납니다. 갈비탕을 만들고 싶지만 외출이 귀찮을 때, 뼈가 없어 뒷처리가 간편한 점이 매력적입니다. 아이들이 혼자서도 쉽게 데워 먹을 수 있어 바쁜 아침이나 늦은 시간에 간편한 저녁으로 적합합니다. 국물 요리가 생각날 때, 당면과 버섯, 대파를 추가하고 후추로 간을 맞추면 더욱 맛있습니다."
1000231898,본 남도식 추어탕,우리 집 쟁여템으로 딱인 추어탕으로 국수도 해 먹고 죽도 해 먹고 다양하게 드셔 보세요 더 맛있게 먹는 팁 따로 삶은 소면 칼국수 넣고 먹으면 추어 국수 밥 넣고 뭉근하게 끓이면 추어 죽 만두랑 채소 추가해서 가족들 다 같이 먹을 수 있는 추어 전골 부추 산초 가루 고춧가루 등 추가해서 먹으면 한 그릇 뚝딱이에요 뜨끈하게 잘 보양했습니다 평소 추어탕 맛집만 찾아다니는 추어탕 마니아 입니다 다음번엔 들깨 가루 추가해서 먹으려구요 본 죽에서 갈비탕도 나왔던 대 추어탕 성공해서 갈비탕도 먹어 보겠습니다 다른 야채들을 따로 준비해서 넣고 끓여야 더 맛있는 것 같아요 집에 들깨 가루 있다면 넣어 먹는 것 추천입니다 여기다가 개인적으로 추가로 산초 조금 넣어서 먹으면 더 맛있음 간편해서 놀러 갈 때 싸 가도 좋을 거 같아요 집에서 몸보신용으로도 강추고 어르신들 먹기에도 진한 국물에 무엇보다 간편해서 좋을 듯요 쟁여 놨다 입맛 없을 때나 저녁 준비 못 했을 때 짠 하고 차려 줘야겠어요 살짝 고춧가루도 조금 첨가해서 끓여 먹었는데 추천 추천해요 날씨가 너무 더워서 입맛이 없었는데 가끔 추어탕 생각 아 났었거든요 청양고추 팍팍 넣어서 같이 먹었어요 매콤한 걸 좋아해서 땡초도 좀 넣어 먹으니 더 맛있어요 추어탕 생각날 때 종종 시켜 먹을게요 끓이기만하면 되서 좋아요 더위에 지쳐서 몸 보신을 위해 추어탕 간편하게 먹으려고 구입했어요 영양 보충해 드리려고 구매했어요 어르신들이 넘 잘 드시네요 다음엔 국물에 수제비 넣어서 먹어 봐야겠어요 들깨 가루 2 스푼 정도 추가했고 끓이면서 중간 중간 거품 걷어 냈어요 입맛 없을 때 먹고 컨디션 회복되엇습니다 시래기가 길어서 잘라먹어요 집에서 간편하게 먹을 수 있어서 좋아요 간편하고 들깨 가루 조금 더 넣어서 먹었어요 있는 채소 더 넣어서 해 먹었어요 전 국물이 뻑뻑해서 물 한 모금 더 넣고 끓여 먹는 게 좋았어요 간편하게 좋아요,"추어탕을 활용하여 다양한 요리를 즐길 수 있습니다. 삶은 소면이나 칼국수를 넣어 추어 국수로 즐기거나, 밥을 넣고 끓여 추어 죽으로 만들어 보세요. 만두와 채소를 추가하면 가족과 함께 나눌 수 있는 추어 전골이 됩니다. 부추, 산초 가루, 고춧가루 등을 추가하면 더욱 맛있게 즐길 수 있습니다. 간편하게 끓이기만 하면 되므로, 바쁜 저녁이나 입맛이 없을 때에도 좋습니다. 영양 보충이 필요할 때나 어르신들께도 추천할 만한 메뉴입니다. 다음에는 들깨 가루를 추가하거나 수제비를 넣어 새로운 맛을 시도해 보세요."
1000235788,왕푸징 마라탕,양을 늘리고 싶어서 팽이버섯과 알 배추 어묵을 추가해서 물은 원래 500ml 넣어야하는데 저는 400ml만 넣었어요 처음부터 딱 맞춰서 넣으시지 마시고 저처럼 일단 적게 넣으신 후 추가하는 걸 추천 드려요 매운 걸 좋아하시는 분들은 매운 소스나 가루를 좀 더 추가하는 걸 추천 드려요 따님에게 마라탕 먹은 거 들켯네요 따님 덕에 한 번 더 시켜야겠습니다 당면이랑 숙주 좋아하시는 분들은 따로 추가하셔야해요 끓이기는 라면보다 쉽네요 재료 추가해서 재주문합니당 집에 있는 야채 추가해 먹어도 될 것 같아요 솔방울 오징어랑 고기 좀 더 추가해서 만들었어요 야채 많이 넣으려고 물 400에 숙주 200다 넣고 고기 더 넣었더니 딱 좋아요 첨부터 500 다 넣지 말고 간 봐 가면서 넣는 걸로 추천이요 집에서 간편하게 먹기는 좋네요 여러 명이서 먹을 때는 버섯 야채 면 추가 필수입니다 채식만두 3개 정도 넣고 숙주도 추가해서 먹었는데 조리 후 남은 국물은 따로 덜어 내서 나중에 마라라면 끓여 먹을 꺼에요 물은 생수 500짜리 병 하나 넣으면 되어서 계량도 편하더라구요 전 당면 숙주 추가로 넣어 먹었습니다 면 추가해서 먹었어요 야채와 면 추가해서 먹으면 푸짐하게 먹을 수 있어요 이것저것 추가해서 한 끼 어른 둘이 배부르게 먹기 좋아요 숙주랑 차돌박이 더 추가해서 끓이면 좋아요 재료 좀 더 추가해서 맛있게 먹겠습니다 왕푸징 좋아해서 주문했어요 다음에는 차라리 배달이나 매장에서 먹는 게 낫겠다는 생각입니다,"팽이버섯, 알 배추, 어묵 등을 추가하여 양을 늘려 먹으면 좋습니다. 물은 처음에 적게 넣고 간을 보면서 추가하는 것이 추천됩니다. 매운 소스를 더해 매운 맛을 즐길 수 있으며, 당면이나 숙주를 추가하면 더욱 푸짐한 한 끼가 됩니다. 여러 명이 함께 먹을 때는 버섯과 야채, 면을 추가하는 것이 필수입니다. 조리 후 남은 국물은 나중에 마라라면으로 활용할 수 있어요. 간편하게 집에서 다양한 재료를 추가해 즐길 수 있습니다."
1000237244,황태 곰탕,아침에 휘리릭 끓여서 먹으려구요 그냥 봉지 뜯고 끓이기만하니까 완성이라서 너무 좋았어요 5분 만에 아침 해결 바쁜 아침에 든든한 한 끼로도 좋겠지만 전 뭐니 뭐니 해도 해장용으로 진짜 더 없이 좋을 것 같더라구요 먹어 보니 제가 두부를 좋아해서 두부 찹찹 썰어 넣어서 끓여도 맛있을 것 같네요 간편하게 먹기 좋은 제품이라 자주 구매하는데 콩나물을 좀 넣고 먹어도 좋아요 두부 좀 넣고 계란 풀어 넣음 더 더 맛남 콩나물 넣어 먹으면 더 좋아요 맛있는 국이 필요할 때 언제든지 데우기만하면 되니 좋아요 먹을 거 없을 때 후루룩 계란 넣고 먹으면 속도 따뜻하고 곰탕 베이스라 떡이랑 만두 넣고 끓여 먹었는데 두부계란 추가하면 맛있어요 세일할 때 쟁여 두고 급할 때 근사하고 든든하게 한 끼 먹을 수 있는 제품입니다 쌀쌀해지니 너무 조아요 물을 1 컵 정도 더 넣으면 조하요 콩나물 두부 추가하고 물도 부어 끓이니 더 맛있어요 이건 요리를 넘어서 거의 숙취해 소제 급이네요 숙취 해소엔 마 마리 황태 곰탕입니다 떡을 넣어서 떡국처럼 먹어 봤는데 요것도 꽤 잘 어울렸답니다 요리는 도전이에요 여러분 편하고 맛있게 잘 먹었어요 반찬 없을 때두 부계란 추가하면 근사하게 한 끼해 결해여 해장용으로 딱입니다 간편하게 먹을 수 있어요 간편하게 먹기 좋고 두부 떡국 계란 추가해서 먹음 한 끼가 되더라구요,"아침에 간편하게 끓여서 먹기 좋습니다. 봉지를 뜯고 5분 만에 완성되니 바쁜 아침에 든든한 한 끼로 적합합니다. 해장용으로도 훌륭하며, 두부를 썰어 넣거나 콩나물을 추가하면 더욱 맛있습니다. 계란을 풀어 넣으면 풍미가 더해지고, 떡이나 만두를 넣어 끓이면 떡국처럼 즐길 수 있습니다. 물을 조금 더 추가하면 국물이 더욱 맛있어지니 참고하세요. 반찬이 없을 때도 간편하게 한 끼를 해결할 수 있는 제품입니다."
1000237311,나주식 한우 곰탕,대파 당면 무 등을 추가하면 더 더 맛있을 것 같습니다 완전 해장 국밥 템이예요 대파 무 넣어 먹으면 더 시원하고 맛있을 것 같아요 파 송송 썰어 넣고 하얀 쌀밥에 김치만 있음 끝 무도 파도 들어가 있어서 밥 휘리릭 말아 먹기에도 딱이에요 해동해서 냄비에 팔팔 끓이기만하면 되니까 차리기에도 진짜 간편하고요 국물 필요할 때 좋은데 무와 두부 더 넣고 끓여도 괜찮네요 당면도 불려서 같이 끓였어요 아침에 간단하게 끓여서 밥 말아서 먹기 너무 좋아요 뜨끈한 국물 필요할 때 굿 떡국 떡 넣어서 끓이면 간 편식 떡국이 뚝딱 완성 아침에 휘리릭 끓여서 먹으려구요 그냥 봉지 뜯고 끓이기만하니까 완성이라서 너무 좋았어요 5분 만에 아침 해결 맛있는 곰탕 반찬 없을 때 좋아요 여름에 불 쓰기도 어려운데 간단한 한 끼 좋아요 1인분 한 끼 식사로 먹기 좋아요 나주 곰탕이 먹기 편해요 반찬 없을 때 냉동실 서 꺼내 먹기 좋아요,"대파, 무, 두부 등을 추가하여 시원한 국밥으로 즐기면 좋습니다. 해동 후 냄비에 끓이기만 하면 되니 간편하게 한 끼를 해결할 수 있습니다. 아침에 간단히 끓여서 밥과 함께 먹거나, 떡국 떡을 넣어 끓이면 맛있는 떡국이 완성됩니다. 반찬이 없을 때나 여름철에 불을 쓰기 어려운 날에도 적합한 간편한 식사입니다. 1인분으로 먹기에도 좋고, 국물이 필요할 때 유용합니다."
1000239335,영양갈비탕,더운 여름에 보양식으로 구매 먹어 보고 괜찮아서 재 주문했어요 물 조금 더 붓고 끓여 주면 아이들이 잘 먹어서,더운 여름에 보양식으로 활용하기 좋습니다. 물을 조금 더 붓고 끓이면 아이들이 잘 먹습니다. 간편하게 조리할 수 있어 가족 모두가 함께 즐기기 좋습니다.
1000239338,사골육개장,반드시 버섯 대파 등등 넣어 먹고 기름 걸러 내야할 듯 요 간편하게 집에서 먹기 좋네요 버섯이랑 파 추가해서 끓여 벅으니 맛있어요 버섯 더 넣고 끓이니 좋더라구 집밥용으로 종종 구입합니다 집에서 국이나 찌개 끓이는 일은 점점 없어지네요 당면 파 계란 더 넣어 먹어도 맛있어요 둘이 간단히 먹기 좋아요 친정엄마에게 보내 드렸는데 너무 좋아하시네요,"버섯, 대파, 당면, 계란 등을 추가하여 국이나 찌개로 끓여 먹으면 맛있습니다. 간편하게 집에서 즐길 수 있어 바쁜 일상 속에 적합합니다. 두 사람이 간단히 나눠 먹기 좋고, 가족에게 선물해도 좋아하는 반응을 얻을 수 있습니다."
