product_id,product_type,review,summarizing
5116406,우리집 순두부찌개,편해서 좋네요 한 끼 식사로 좋아요 시간이 없어 있는 그대로 끓여 먹었는데 팽이버섯 순두부 등 더 넣어 먹음 더 좋을 것 같아요 간단히 먹긴 나쁘지 않음 물을 더 부어서 먹었습니다 재료 조금 더 추가해서 먹으니 더 맛있었어요 자주 먹어요 퇴근하고 햇반에 이거 하나 데우면 맛있게 한 끼 해결 가능합니다 간편해서 좋네요 다른 야채 추가해서 먹었어요 두부도 넣어 먹으니 더 맛있네요 바지락 추가하면 더 좋겠어요 간편하게 끓여 먹기 좋아요 간단하게 데워 먹기 좋아요 두부 조금 더 넣어서 아이 둘이 한 끼 먹었어요,"시간이 없을 때 간편하게 끓여 먹기 좋습니다. 팽이버섯이나 순두부, 바지락 등을 추가하면 더욱 맛있습니다. 퇴근 후 햇반과 함께 데워서 한 끼 해결하기 좋고, 두부를 더 넣으면 아이들도 잘 먹습니다. 다양한 야채를 추가해 보세요."
5116407,정갈한 소고기 미역국,간편하게 끓이기만해서 편했고 간단히 먹을 때 데워 먹으려고 샀는데 이거 사서 씨 국물로 쓰세요 한 끼 간편하게 먹기 좋아요 간편하게 미역국 먹을 수 있어서 넘 조아요 바쁠 땐 이걸로 먹어요 빨라서 좋아요 아침 식사로 급하게 준비 다음에는 다른 거 사려구요 자주 먹어요 간편하고 좋아요 급할 때 바로 먹기 좋네요,간편하게 끓이기만 하면 미역국으로 즐길 수 있어 바쁜 아침 식사에 적합합니다. 씨 국물로 활용하면 한 끼를 손쉽게 해결할 수 있어 매우 편리합니다. 급할 때 빠르게 준비할 수 있어 자주 찾게 되는 제품입니다.
5116408,정갈한 소고기 무국,물 많이 넣고 끓인 담에 파 썰어 넣고 소금 간 좀 더해서 양 불려서 먹습니다 참기름 쌀 짝 둘러 먹으면 아주 좋아용 급할 때 아이 국으로 유용 집에서 끓인 맛 그 자체여서 자주 사요 파 송송 썰어 넣어 먹어 주면 딱 그냥 정석 소고기 무 국이에요 간편하게 먹기 좋습니다 국 없을 때 비상용 맛있어요 새로 육수 끓인 거랑 섞으니 괜찮아요 자주 구매해서 맛있게 먹고 있어요 간편히게 때우기 좋아요 국 끓이기 귀찮을 때 좋아요 생각날 때마다 사서 맛나게 먹고 있습니다 힘들게 요리할 필요 없이 간편하고 좋아요 아이 국으로 급할 때 유용,"물과 함께 끓인 후 파를 썰어 넣고 소금으로 간을 맞추면 간편하게 소고기 무국을 즐길 수 있습니다. 참기름을 둘러주면 더욱 맛있습니다. 국이 없을 때 비상용으로 좋고, 새로 육수를 끓인 것과 섞어도 괜찮습니다. 요리하기 귀찮을 때나 급할 때 아이 국으로 활용하기 좋습니다."
5116411,달래 된장찌개,두부도 같이 넣어 주면 더 맛나요 애들도 잘 먹네요 좀 짭짤한데 두부 반 모 넣으면 좋아요 이거 저거 추가해서 먹으면 아주 맛있는 된장찌개가 됩니다 이거 저거 좀 더 추가해서 먹어야함 재료가 좀 단순해서 두부랑 버섯 넣고 끓이니까 맛있네요 두부 추가합니다,두부와 버섯을 추가하여 맛있는 된장찌개를 만들 수 있습니다. 두부 반 모를 넣으면 짭짤한 맛이 조화롭게 어우러져 아이들도 잘 먹습니다. 다양한 재료를 추가해 더욱 풍성한 맛을 즐길 수 있습니다.
5119423,시래기 된장국,기호에 따라 멸치 추가하고 물 좀 더 넣어 끓여도 될 듯 그대로 냄비에 넣어 간편하게 한 끼 먹기 딱 좋네요 두부 첨가해서 먹었어요 아침에 후루룩 간단히 먹기 좋앗어요 간단히 먹기 좋야요 팽이버섯하고 두부 넣어 봤어요 물 좀 더 부워서 끓이니 좋네요,"기호에 따라 멸치와 두부를 추가하여 끓이면 더욱 맛있습니다. 아침에 간편하게 후루룩 먹기 좋고, 팽이버섯을 넣어도 좋습니다. 물을 조금 더 부어 끓이면 국물이 풍부해져 더욱 맛있게 즐길 수 있습니다."
5119471,들깨 미역국,아이 어른 할 것 없이 한 번에 해결할 수 있다 보니 남은 마마리 오징어 국 먹어 보고 추가 주문할 듯하네요 내용물을 냄비에 중강 불로 조리해요 살짝 넓은 냄비에 조리하니 국물이 없는 느낌으로 많이 졸여지더라고요 폭이 좁은 냄비에 조리를 추천 드립니다 간편하기도해서 컬리주문할 때 재주문해서 먹고 있어요 더운 여름이지만 에어컨 틀고 시원하게 금방 해동해 끓여 먹음 든든하고 좋네요 특히 바쁜 아침에도 금방 든든하게 먹일 수 있으니 좋고 또 캠핑 때도 한 팩씩 챙겨 얼음 팩처럼 보냉 가방에 넣어서 갖고 가 끓여 먹음 넘 좋아요 간편하게 건강식 먹을 수 있어서 자주 구매해 먹고 있어요 요샌 컬리에서 간편하게 구입해서 먹을 수 있어서 딱 좋아요 부담 없이 먹기 너무 좋습니다 속 편해서 아침 국으로 좋아요 국 종류는 손수 잘 끓여 먹는데 들깨 가루 조금 더 넣어 먹었도 좋아요 맛있게 한 끼 때우기 좋아요 들깨를 좋아해서 구매했어요 들깨 미역국은 처음이예요,"남은 오징어 국을 냄비에 중강 불로 조리하면 간편하게 한 끼를 해결할 수 있습니다. 폭이 좁은 냄비에서 조리하면 국물이 잘 졸여져 더욱 맛있습니다. 더운 여름에는 에어컨을 틀고 시원하게 해동해 끓여 먹으면 든든하고 좋습니다. 바쁜 아침에도 빠르게 준비할 수 있어 아이들에게도 좋고, 캠핑 시에는 보냉 가방에 넣어 한 팩씩 챙겨가면 간편하게 건강식을 즐길 수 있습니다. 들깨 가루를 추가하면 더욱 맛있게 즐길 수 있습니다."
5119615,금돼지식당 김치찌개,그냥 끓여서 먹거나 전자렌지에 돌려서 먹어도 맛있다고 컬리에서 대파 두부를 추가로 구입해서 넣어 봤습니다 집에 있는 먹다 만 스팸도 같이 추가했어요 주말에 일어나자마자 먹었는데 너무 간단해서 편하게 먹을 수 있었어요 살까 말까 고민하시는 분들은 꼭 사 보세요 두부나 스팸 추가해 주시면 더 맛있으니까 꼭 추가해 주세요 저처럼 기존 김치찌개를 살리면서 추가 재료만 해서 맛있는 식사 하세요 남편 혼자 뚝딱 해 먹기도 좋고 당면 뿔려서 짜글이처럼 해 먹을 수도 있고 간편하게 뜯어서 냄비에 착 넣어 끓이기만하면 되니까 너무너무 간편한 한 끼 뚝딱 간편한 기도 하고요 삼겹살이나 두부 추가해서 먹어요 두부 고기 추가해서 끓이면 맛있어요 김치찌개가 급 땡기는데 재료 다 챙겨 끓이기 귀찮을 때 살짝 해동 후 살얼음 상태로 냄비에 끓이기만하면 되는 간편함 두부 반 모 파 썰어 넣고 먹습니다 한 끼 간 편히 먹기 좋네요 호박 넣어 끓였어요 두부 넣고 햄 넣고 물 넣고 양념 살짝 추가해서 밥하기 귀찮을 때 이거 하나면 밥 한 공기 뚝딱 두부랑 고기 추가해서 먹음 더 맛있어요 다른 것 사 먹다 이 제품으로 다시 구매 제겐 딱 좋네요 두부 조금 더 넣고 먹게 되는데 파랑 두부를 넣고 끓인 후 제 입맛엔 덜 진해서 두부랑 햄이랑 조금 더 추가해서 끓여 먹을 생각입니다 가끔 이용할 수 있는 김치찌개네요,"기본적으로 끓이거나 전자레인지에 데워서 간편하게 즐길 수 있습니다. 대파와 두부, 스팸을 추가하면 더욱 맛있어지며, 주말 아침에 간단하게 한 끼를 해결하기 좋습니다. 김치찌개를 살리면서 추가 재료로 풍미를 더할 수 있고, 당면을 넣어 짜글이처럼 변형해 먹는 것도 추천합니다. 두부와 고기를 추가하면 더욱 맛있고, 귀찮을 때는 살짝 해동 후 끓이기만 하면 됩니다. 호박이나 다른 야채를 넣어도 좋고, 양념을 살짝 추가하면 밥 한 공기를 뚝딱 비울 수 있는 간편한 식사로 활용할 수 있습니다."
5123141,옛날 한우 육개장 500g,고사리랑 대파 더 추가했어요 국 끓이기 싫을 때 간편하게 끓여 먹어요 숙주와 느타리버섯 육수를 첨가하고 거기에 청양고추 가루와 집 간장으로 간 해서 3 인분으로 맹글어 먹어요 맛있어요 아침 식사 국으로 좋은 것 같습니다 추운 날 딱이에요 식사 준비 귀찮을 때 무난합니다 밥 대신 두유면 넣어서 잘 먹었어요 이것저것 더 넣어서 맛있게 먹었어요 재구 매 할래요 육개장이 생각 날 때 설성 목장 한우 육개장을 선택합니다 야채 더 넣어서 먹어요,"고사리와 대파를 추가하여 간편하게 국을 끓여 먹을 수 있습니다. 숙주와 느타리버섯 육수를 넣고 청양고추 가루와 간장으로 간을 맞추면 맛있습니다. 아침 식사로 좋고, 추운 날에 특히 잘 어울립니다. 식사 준비가 귀찮을 때도 무난하게 즐길 수 있으며, 밥 대신 두유면을 넣어도 맛있습니다. 다양한 재료를 추가하여 더욱 풍성하게 즐길 수 있습니다."
5125749,차돌 된장찌개 460g,두부 추가해서 먹어요 간편하고 맛있어용 데우기만하면 돼서 먹기 편해요 건더기가 좀 없긴 해서 두부랑 애호박 같은 거 더 넣으면 좋아요 고기가 좀 아쉬워서 집에 있는 고기랑 두부 더 넣어서 먹었더니 훌륭하네요 그냥 양념장 사서 해 먹는 게 체고 국 끓이기 귀찮을 때 좋아요 캠핑 갈 때 찌개로 먹으려고 샀네요 간편해요 후기가 좋아서 두부 야채 추가해서 끓여 보려구요 두부 더 넣어서 먹었어요 집에 있는 우 삼 겹 추가로 더 넣어서 먹었더니 여행 갈 때 필수입니다 밥 말고 짜글이 타입으로 먹어도 강추 캠핑 갈 때 너무 간편하고 좋아요 된장찌개 좋아해서 자주 구매 야채 추가로 더 넣으면 되고 편리해요 간편하고 맛있게 먹었어요 재료 더 넣고 끓여 먹어도 맛있어요 여름이라 된장 끓이기도 힘드는데 두부만 넣어도 괜찮네요 여기에 대파 고추 두부 감자 등 추가해서 먹어요,"두부와 애호박, 대파, 고추, 감자 등 집에 있는 야채를 추가하여 간편하게 찌개로 끓여 먹으면 좋습니다. 고기가 아쉬운 경우에는 삼겹살이나 다른 고기를 더 넣어 풍미를 더할 수 있습니다. 데우기만 하면 되기 때문에 캠핑이나 바쁜 일상 속에서도 쉽게 한 끼를 해결할 수 있습니다. 여름철에는 두부만 넣어 간단하게 즐기기에도 좋습니다."
5125750,소고기무국 500g,국이 필요할 땐 간편하게 좋습니다 그냥 끓이면 돼서 편해요 다음에 데울 때 소금 아직 조금만 넣어서 먹으려고 찌개 끓이기 귀찮을 때 끓이기 좋아요 조리도  편하고 맛도 좋았어요 시간 없는 직장인에게 좋은 식품으로 추천 밥 말아서 먹으니 넘 맛있네요 간편하고 너무 좋아요 두부는 따로 넣었어요 간편하구요,"국이 필요할 땐 간편하게 끓여서 먹으면 좋습니다. 데울 때 소금을 조금 추가하면 맛이 더 좋아요. 찌개를 끓이기 귀찮을 때 빠르게 조리할 수 있어 바쁜 직장인에게 추천합니다. 밥을 말아서 먹으면 더욱 맛있고, 두부를 따로 넣으면 영양도 챙길 수 있습니다."
5128143,육개장,별도해 동 없이 전자레인지에 돌려 먹어도 되고 냄비에 넣어 5분 정도 끓여도 되서 너무 간편했어요 추천이요 얼큰하지 않아서 청양고추 가루 듬쁙 넣고 대파 더 넣어 먹었어요 겨울엔 칼칼한 국물 요리가 땡기죠 보기에도 이쁜 게 먹기도 좋다고 계란 지단 준비해 놓구요 매운 거 좋아하심 청양고추나 고춧가루 넣는 걸 추천 드려요 그냥 드실 땐 당면 넣어서 먹어도 맛있을 거 같아요 칼칼한 만두전골로 먹어도 맛있을 거 같아요 본인이 소고기랑 야채를 첨가해 먹으면 더 좋을 꺼 같아요 해장으로 딱입니다 대파 듬뿍 더 넣고 표고버섯 한 개 더 넣고 끓였는데 맛있어요 대파랑 숙주 추가해서 먹었더니 그나마 좀 나은 듯하네요 불려서 대파 많이 넣고 끓였더니 더 맛나요 대파 많이 많이 순두부 넣으면 딸도 좋아해요,"전자레인지에 간편하게 조리하거나 냄비에 끓여서 즐길 수 있습니다. 얼큰한 맛을 원한다면 청양고추 가루와 대파를 추가해 보세요. 겨울철에는 칼칼한 국물 요리로 좋고, 계란 지단을 곁들이면 더욱 맛있습니다. 당면을 넣어 먹거나, 소고기와 야채를 추가해 칼칼한 만두전골로 변신시킬 수도 있습니다. 대파와 표고버섯, 숙주를 더하면 풍미가 살아나고, 순두부를 넣으면 아이들도 좋아할 만한 맛이 됩니다. 해장용으로도 적합합니다."
5128947,프리미엄 전통육개장,매장에서만 먹던 육개장 포장으로 먹으니 간편합니다 급할 때 2 인이 간편하게 먹기 좋을 꺼 같아요 육개장 아침에 밥 말아서 먹고 가기 좋으네요 계란 풀어서 먹으니 맛나요 당면은 따로 넣어서 먹었어요 파를 썰어 줘야지 한 단을 그냥 넣었나 봐요,"매장에서 즐기던 육개장을 포장해 간편하게 먹을 수 있습니다. 급할 때 2인이 함께 먹기 좋고, 아침에 밥을 말아 먹으면 간편합니다. 계란을 풀어 넣으면 더욱 맛있고, 당면은 따로 넣어 먹는 것이 좋습니다. 파는 썰어서 넣으면 더 맛있습니다."
5131413,맑은 나주식곰탕,안에 계란 고명파도 다 들어 있어서 해동만 해서 끓이기만하면 되니 간편하구요 너무 맛있네요 감기 걸려서 뜨끈하게 해서 두 끼 먹었네요 냉동된 것 해동하고 냄비에 끓여 먹었는데 떡국 넣어 드세요 아이들도 밥 말아서 한 끼 뚝딱이네요 간편해요 진짜 괜찮아서 다음에 또 먹을 예정 편하게 떡국 끓이기 좋아,"해동 후 냄비에 끓이기만 하면 간편하게 맛있는 떡국을 즐길 수 있습니다. 감기 걸렸을 때 뜨끈하게 먹기 좋고, 아이들과 함께 밥을 말아 한 끼로 해결하기에도 적합합니다. 다음에도 다시 먹고 싶을 정도로 만족스러운 제품입니다."
5131921,맑은곰탕,꼭 소면을 삶아 맑은 곰탕 국물과 같이 먹어 보시라 추천합니다 간편하게 먹을 수 있고 맛도 좋은 곰탕 잘 먹었습니다 파도 내용물에 포함되어 있으니 따로 준비 안 해도 됩니다 떡국 끓이기에 너무 좋고 파 좋아해서 듬뿍 넣어 먹어요 ㅋ 한 끼용으로 좋아요 곰탕 아가랑 먹기 좋아요 밥하기 귀찮고 먹기 귀찮을 때 맑은 곰탕에 떡국 떡 넣어서 끓여 먹어 보세용 아이도 좋아해요 야채랑 같이 끓여 먹어요 떡 넣어서 먹으니 아이도 잘 먹고 좋아여 반찬 없을 때 밥 말아 먹기 딱 적당해요 간단해서 종종 먹기 좋아요 소면 사리 같이 넣어서 먹으니 맛있어요,"소면을 삶아 맑은 곰탕 국물과 함께 먹으면 간편하고 맛있습니다. 떡국 떡을 넣어 끓이면 아이들도 좋아하고, 야채를 추가해도 좋습니다. 반찬이 없을 때 밥을 말아 먹기에도 적합하며, 간단하게 한 끼를 해결할 수 있습니다."
5132868,부산깡통시장 유부주머니,물 조금 더 넣고 기호에 따라 원하는 재료 넣어서 끓여 먹으면 푸짐하고 맛있습니다 대파와 시치미도 첨가했어요 어묵탕이나 전골 요리에 꼭 넣어 먹어 보세요 해동 따로 필요 없이 유부 주머니는 나중에 4분 정도만 끓여 주면 끝 매콤하게 매운 건고추 넣고 국물 지저분해지지 않도록 통마늘 한 줌 대파도 통으로 구워서 넣었구요 마지막에 후추 팍팍 뿌렸더니 삶은 반숙 란 넣고 싶었는데 귀찮아서 패스 이것도 넣어서 노른자 마지막에 국물에 풀어 먹으멱 끝 나겠네요 어묵 국에 추가해서 넣어 먹으려 샀는데 금방 풀어지니까 너무 오래 끓이면 안 되요 어묵탕에 같이 끓여 먹기 좋아서 우동이나 어묵탕에 같이 넣으니 맛있네요 어묵탕에 넣어도 각종 탕 종류에 넣어도 일품 어묵 꼬지 넣고 끓이니 근사한 한 끼가 되었네요 간편하게 술 한잔 하고 싶을 때 이거 하나 놓고 다른 거 필요 없이 한 팟에 내놓으면 딱 좋더라구요 곤약 면 버섯 대파 추가했어요 약간만 넣고 나머지는 집에 있는 일제 가츠오부시 쯔유로 간 맞췄어요 7분 정도 끓이면 좋고 너무 오래 끓이면 당면이 너무 불어 터지고 멋 없으니 참고 하세요 유부 주머니 직접 만들려면 귀찮고 손만 많이 가는데 또 가끔 생각 나는 별 것도 아닌데 그냥 육수에 툭툭 넣고 끓이면 어묵탕하고는 또 다른 매력의 요리 샤브샤브 요리 할 때 같이 넣어서 먹으면 좋아요 후기들이 매우 좋아서 구매했어요 어묵탕 끓이면서 유부 주머니 넣었어요 어묵 추가해서 먹었어요 따뜻한 국물 땡길 때 좋아요 파 썰어서 먹으니 더 좋았습니다 어묵탕 끓일 때 같이 넣었어요 여기저기 활용하기 좋아요 어묵이나 우동 사리 넣고 끓여 셋이 먹으면 딱 좋겠어요 우동 추가해서 먹었어요 당분간 이건 좀 쉬어야겠어요 겨울에 먹기 너무 좋아요 술안주로 좋을 것 같아요 오뎅 탕 유사하게 만들었네요 편하고 맛있어서 지인 집에 해 먹었는데 추울 때 이만한 게 없어요,"물과 함께 기호에 맞는 재료를 추가해 끓이면 푸짐하고 맛있는 요리를 즐길 수 있습니다. 대파와 시치미를 넣어 어묵탕이나 전골 요리에 활용해 보세요. 유부 주머니는 해동 없이 간편하게 4분 정도 끓이면 되고, 매운 맛을 원한다면 고추를 추가해도 좋습니다. 통마늘과 대파를 통으로 넣어 구워주면 풍미가 더해집니다. 

어묵탕에 어묵이나 우동 사리를 추가해 간편하게 한 끼를 만들 수 있으며, 곤약 면과 버섯을 넣어 더욱 풍성하게 즐길 수 있습니다. 육수에 간단히 넣고 끓이면 별미가 되며, 샤브샤브 요리에도 잘 어울립니다. 추운 날씨에 따뜻한 국물이 생각날 때, 술안주로도 훌륭한 선택입니다."
5133941,삼계탕 900g,요리 고수 느낌이 납니다 아 가나 아이들 먹을 땐 젓가락으로 톡톡 톡 확인 잘해서 걸러 내고 먹이면 정말 정말 좋아할 거에요 둥구나 무 오미자 생채 곁들이면 최고입니다 외식 할 필요가 없음 밥 하기 귀찮을 때나 보양식 챙길 때 최고 왜 지퍼에 통째로 데우라고 했는지 알겠어요 맛술과 삼계탕 한약재 마늘 더 넣고 끓여 먹었어요 냉장 포장 뜯으면 안 쪽에 붙은 누런 닭 기름 제거하고 먹으면 비린내 덜 날 것 같으니 꼭 제거하고 드세요 국물이 별로 없어서 냄비에 덜어 데우기보단 끓는 물에 그대로 넣어 데워야하지만 전반적으로 간편하게 먹을려다 삼계탕으로 먹다가 남편 속이 안 좋아서 삼계 죽으로 변신 1물을 넉넉히 넣고 끊인다 집에 있는 치킨 스톡 나 육수 한 알을 넣는다 집밥이나 햇반 당근을 넣고 끊인다 잘 저어 주면서 뼈를 발라낸다 집에 있는 능이 해삼 전복 등 투하 부추랑 후추 참기름 조금 넘고 마무리 정말 쉽고 물을 반 컵 정도 더 넣고 끓였는데 10분 정도 뒤적 뒤적 끓이니 안도 충분히 잘 익었네요 데우기만해서 먹으니 너무 좋으네요 추천할 만합니다 더운 날씨에 외출하지 않고 집에서 몸보신 하기에 넘 좋습니다 중탕했을 때보다 파 넣고 끓였더니 훨씬 낫네요 집에서 간편하게 보양식 챙겨 먹었어요 전 전복 넣고 냄비에 푹 끓였어요 둘이 먹을 꺼라 집에 있는 찹쌀 한 주먹 불려서 미리 끓이다가 제품 더 해서 먹었네요 더운 날 뜨끈한 음식 간편하게 맛있게 잘 먹었어요,"아이들이 먹을 때는 젓가락으로 잘 걸러서 주면 좋아합니다. 둥구나, 무, 오미자 생채를 곁들이면 더욱 맛있습니다. 바쁜 날이나 보양식이 필요할 때 간편하게 활용할 수 있습니다. 맛술과 삼계탕 한약재, 마늘을 추가해 끓이면 풍미가 더해집니다. 국물이 적어 끓는 물에 통째로 넣어 데우는 것이 좋습니다. 남은 삼계탕은 죽으로 변신시켜도 좋고, 집에 있는 육수나 스톡을 넣어 끓이면 더욱 맛있습니다. 부추와 후추, 참기름으로 마무리하면 간편한 보양식이 완성됩니다. 더운 날씨에 집에서 간편하게 몸보신하기에 적합합니다."
5134147,한돈 갈비 김치찌개,급하게 먹어야할 경우에는 흐르는 물에 해동을 하기도하고 이 제품 같은 경우는 중탕으로도 조리 가능하고 냄비로 옮겨서 팔팔 끓여서 조리를 하기 때문에 조리가 너무 간편하기에 집에 놓고 반찬 없을 때 금방 조리해서 먹기에 좋네요 돈이 아까워서 안에 고기 다 건져 내고 참치 넣고 청양고추 넣어서 다시 해 먹었습니다 두부 추가해서 먹었어요 냄비에 보글보글 끓여서 먹었어요 두부와 파 넣어 먹었어요 편하고 좋네요 김치랑 마늘 대파 팍팍 넣고 재조리해서 먹었네요 주변에 추천도 하고 있고,"급하게 먹어야 할 때 흐르는 물에 해동하거나 중탕으로 간편하게 조리할 수 있습니다. 냄비에 옮겨서 끓이면 빠르게 준비할 수 있어 반찬이 없을 때 유용합니다. 고기를 건져내고 참치, 청양고추, 두부, 대파 등을 추가해 보글보글 끓여 먹으면 맛있습니다. 김치와 마늘을 넣어 재조리하면 더욱 풍미가 살아납니다."
5136026,영양삼계탕,한 끼 먹기 딱 좋아요 간단하게 조리할 수 있어 좋아요,간단하게 조리할 수 있어 바쁜 일상 속에서 한 끼로 적합합니다. 빠르게 준비할 수 있어 자취생이나 바쁜 직장인에게 안성맞춤입니다.
5144534,미소 된장국 (5개입),간편 된장국 주문했어요 설명서대로 뜨거운 물 170ml 붓고 2분 기다리니 덩어리가 잘 풀어집니다 물 조절은 기호에 맞게하면 되겠어요 재주문할께요 간편한데 맛까지 잡은 미소 된장국입니다 국물을 너무 좋아하는 아이인데 매번 해 줄 수가 없어 고민하던 중 만나게 된 제품이에요 다른 준비 과정 필요 없이 그릇에 뜨거운 물만 부어 주면 완성 되는 미소 된장국입니다 간이 좀 강하다 싶으면 물을 좀 더 부으면 되니 각자 취향에 맞춰서 물 조절을 해 주면 더 좋을 것 같습니다 간편해서 좋아요 간 간하게 반찬 없이 밥과 함께 먹을 수 있었습니다 뜨거운 물만 넣으면 되니 좋네요 물 양은 정량을 지키되 입맛에 맞게 가감하면 좋을 듯 합니다 이 제품 자주 사용하요 간편하 기조 하고 가볍게 한 끼 차리기에 좋을 것 같아요 휘리릭 국 끓일 때 넘 편하네요 물을 레시피보다 더 넣구 고추장도 넣었어요 두부만 넣어서 끓여 먹었어요 집에서는 뜨겁게 먹는 게 좋자나요 캠핑 갈 때는 진짜 간편하다고 생각합니다 간단하게 캠핑이나 아이들 반찬 없을 때 간편해서 해 먹기 좋아요 국물 먹고 싶을 때 간편하고 편해요 전 연두부 넣어 먹으니 괜찮네요 간편하고 등산 갈 때 꼭 하나씩 챙겨 갑니다 건강 위해 김밥에 물만 부으면 되는 즉석 국으로 대신 1 인분 미소 된장국 간편하고 좋아요 아기가 너무 잘 먹어서 좋아요 간편하긴하지만 재구매는 안 할 듯 합니다 블럭 국이라 그냥 끓는 물 부으면 돼서 편리해요 급할 때 여행 갈 때 좋을 거 같아 구매했어요 1 인 가구나 캠핑 시 진짜 유용할 듯하네요 밥이랑 먹기 무난해요 애들 국 없을 때 물 넣고 끓여쥬기 최고예요 국 없을 때 빠르게 할 수 있어서 좋아요 국 끓이기 싫을 때 너무 좋아요 간편하게 국 먹을 때 편하네요 국 거리 없을 때 급할 때 먹기 좋아요 자주 먹습니다 간단하게 물만 부어서 밖에서 사람들과 따뜻하고 간편하게 먹을 땐 추천합니다 엄청 간편한데,뜨거운 물 170ml를 붓고 2분 기다리면 간편하게 미소 된장국이 완성됩니다. 물의 양은 개인 취향에 맞게 조절할 수 있어요. 아이들 반찬이 필요할 때나 캠핑 시에 간편하게 즐기기 좋습니다. 두부를 추가하거나 고추장을 넣어 변화를 줄 수도 있습니다. 급할 때나 여행 중에도 유용하게 사용할 수 있어요. 간단하게 국물이 필요할 때 빠르게 해결할 수 있는 제품입니다.
