product_id,review,category
1000198908,냉동실에 있던 우거지가 있어서 같이 해동시켜 대파와 마늘 고추가루 더 넣어서 끓인 후,활용 방법
1000198908,건더기 사이에 잔뼈가 씹여서 살짝 당황스러웠어요,양
1000198908,조심해서 드셔야겠어요,양
1000198908,들깨 가루 깻잎 있으면 첨 해서 드세요 훨씬 맛나요,활용 방법
1000198908,고기가 너무 퍽퍽해서 못 먹겠네요,맛/향/풍미
1000198908,가격도 저렴한데,가격
1000198908,맛도 좋아요,맛/향/풍미
1000198908,갑자기 식사 준비해야 되거나 저녁 메뉴로 뚝딱 너무 간편해서 좋아요,활용 방법
1000198908,김치 살짝 썰어 넣어 만드는데 밥에 비벼 먹으면 밥도둑이에요,활용 방법
1000198908,23 인분은 되는 거 같아요,양
1000198908,푸짐하고 맛있게 한 끼 최고에요,양
1000198908,냄새가 좀 나는 거 같아요,맛/향/풍미
1000198908,본래 가격이 8900원이던 데 요즘 브랜드 해장국 한 그릇 9 천 원 하니까 그냥 딱 그 만큼의 양이 고요,양
1000198908,포장이라서 작은 뼈로 4개 들었습니다,양
1000198908,솔직히 이 가격에 1인분일 것 같으면 설거지도 안 나오고 김치도 먹을 수 있는 매장 방문 권장합니다,가격
1000198908,저는 그냥 집 앞 감자탕 포장 전문점이 25 인분 17000원이라 그거 사 먹으려고요,가격
1000198908,아님 진짜 매장이 낫습니다,가격
1000198908,비릿한 향이 나고,맛/향/풍미
1000198908,고기도 살이 진짜 없네요,양
1000198908,감자탕 맛있어서 자주 먹어요,맛/향/풍미
5123141,맛 괜찮아요,맛/향/풍미
5123141,고사리랑 대파 더 추가했어요,활용 방법
5123141,고기도 먹을 만하고,맛/향/풍미
5123141,재구매 할 거예요,보관
5123141,설성 목장 제품은 다 맛있어요,맛/향/풍미
5123141,검증된 맛이라 떨어지면 냉장고에 쟁겨 두고,보관
5123141,국 끓이기 싫을 때 간편하게 끓여 먹어요,활용 방법
5123141,자극적이지 않고 맛이 깔끔해요,맛/향/풍미
5123141,이건 다시 안 샀으면 좋겠다는 피드백 받았습니다,맛/향/풍미
5123141,양은 많지는 않지만,양
5123141,맛은 깔끔하고 묵직합니다,맛/향/풍미
5123141,숙주와 느타리버섯 육수를 첨가하고 거기에 청양고추 가루와 집 간장으로 간 해서,활용 방법
5123141,3 인분으로 맹글어 먹어요 맛있어요,활용 방법
5123141,맵지는 않습니다,맛/향/풍미
5123141,냉동 제품이라 식당에서 먹는 맛은 아니지만,포장/배송
5123141,아침 식사 국으로 좋은 것 같습니다,활용 방법
5123141,이거 진짜 맛있던데요,맛/향/풍미
5123141,찢은 고기가 아니라 슬라이스인 점이 조금 아쉽,양
5123141,추운 날 딱이에요,활용 방법
5123141,자극적이지 않은 육개장,맛/향/풍미
5123141,설성 목장 육개장은 믿고 먹는 제품입니다,맛/향/풍미
5123141,조미료 안 들어간 자연스런 옛날 육개장 맛이라서 좋습니다,맛/향/풍미
5123141,강추입니다,맛/향/풍미
5123141,자극적이지 않고 맛있어요,맛/향/풍미
5123141,한우라서 다른 육개장에 비해 비싸긴해요,가격
5123141,가격이 비싸서 자주 주문하긴 어려운 상품이지만,가격
5123141,맛은 역시 좋네요,맛/향/풍미
5123141,느끼하지 않고 깔끔한 맛이라서 좋아요,맛/향/풍미
5123141,크게 맛난 건 아닌데,맛/향/풍미
5123141,한우라고 하니 주문했어요,맛/향/풍미
5123141,왠지 건강한 느낌,맛/향/풍미
5123141,식사 준비 귀찮을 때 무난합니다,활용 방법
5123141,설성 목장 식품은 모두 맛있어요,맛/향/풍미
5123141,첨가물이 없어서 더 더 좋답니다,맛/향/풍미
5123141,자극적이지 않은 맛,맛/향/풍미
5123141,맛있어요,맛/향/풍미
5123141,딸과 둘이 먹기 딱 맞는 양이에요,양
5123141,맵찔이는 콧물 흘리며 먹긴했지만 참고 먹을 수 있는 정도 맵기입니다,맛/향/풍미
5123141,맛이 깔끔해서 괜찮더라구요,맛/향/풍미
5123141,고춧가루만 더 첨가했어요,맛/향/풍미
5123141,역시 재료가 좋았나 봐요,맛/향/풍미
5123141,정말 맛있네요,맛/향/풍미
5123141,가을이면 육개장을 사서 쟁여서 먹는데,보관
5123141,여기저기 먹어 봤지만 최고네요,맛/향/풍미
5123141,버뜨 그래서 비싼가 봐요,가격
5123141,육개장 포함 절반 가량 녹아서 왔네요,포장/배송
5123141,봉지가 터진 건 아니니 다행이긴한데,포장/배송
5123141,함께 구입한 상품들 죄다 녹아 와서,포장/배송
5123141,냉장 식품은 고사하고 녹은 제품 강제로 먹어치워야할 상황,포장/배송
5123141,진하고 맛있는 한우 육개장,맛/향/풍미
5123141,밥 대신 두유면 넣어서 잘 먹었어요,활용 방법
5123141,설성 농장 성분이 좋아서 애용합니다,맛/향/풍미
5123141,특히 한우 육개장 최고입니다,맛/향/풍미
5123141,후추 맛이 강하긴해도,맛/향/풍미
5123141,시골에서 끓인 육개장 같아요,맛/향/풍미
5123141,간도 쎄지 않고,맛/향/풍미
5123141,건더기도 적당히 들어 있어요,양
5123141,조미료 맛도 많이 안 나요,맛/향/풍미
5123141,얼큰하지 않고 고기는 많이 안 들었어요,맛/향/풍미
5123141,장터 국밥 같은 느낌,맛/향/풍미
5123141,한우 고기와 느타리 토란 대 고사리 건지가 많아,양
5123141,푸짐하고 얼큰해요,맛/향/풍미
5123141,육개장 맛있어요,맛/향/풍미
5123141,양은 적지만,양
5123141,믿고 먹어요,맛/향/풍미
5123141,이것저것 더 넣어서 맛있게 먹었어요,활용 방법
5123141,너무 자극적이지 않은 육개장 맛있습니다,맛/향/풍미
5123141,3명이 두 개로는 모자라네요,양
5123141,앞으로는 하나 더 주문해야할까 봐요,양
5123141,오호 집에서 끊인 맛이네요,맛/향/풍미
5123141,자극적이지 않고 맛나요,맛/향/풍미
5123141,재구 매 할래요,활용 방법
5123141,육개장이 생각 날 때,활용 방법
5123141,설성 목장 한우 육개장을 선택합니다,활용 방법
5123141,쫌 싱거워요,맛/향/풍미
5123141,고기는 굿,맛/향/풍미
5123141,맛있네요,맛/향/풍미
5123141,자주 사 먹어요,보관
5123141,맛있구요,맛/향/풍미
5123141,야채 더 넣어서 먹어요,활용 방법
5123141,자극적이지 않은 육개장입니다,맛/향/풍미
5123141,맛있어요,맛/향/풍미
5123141,칼 깔한 맛,맛/향/풍미
5123141,식욕을 일으킵니다,맛/향/풍미
1000237311,국물이 구수하고 깔끔한 곰탕이네요,맛/향/풍미
1000237311,대파 당면 무 등을 추가하면 더 더 맛있을 것 같습니다,활용 방법
1000237311,양은 성인 2 인이 먹기에는 조금 부족한 것 같고,양
1000237311,혼자서 든든하게 먹기 좋은 양인 것 같습니다,양
1000237311,국물이 정말 넉넉하게 들어 있고 고기도 56점 있어서,양
1000237311,특이 한우인데 이렇게 고기 넉넉히 들어 있는 국이 오랜만이어서 반가웠네요,양
1000237311,완전 해장 국밥 템이예요,활용 방법
1000237311,대파 무 넣어 먹으면 더 시원하고 맛있을 것 같아요,활용 방법
1000237311,할인할 때 궁금해서 한 개만 사서 먹어 보고는 일 일 특가 때 6개를 쟁였습니다,보관
1000237311,10개를 사고 싶었으나 냉동실 자리 때문에 자중한 거랍니다,보관
1000237311,지금껏 먹어 본 국 종류 하얀 국 밀 키트 중에서 최고,맛/향/풍미
1000237311,1 인 1 팩 필수 고기가 1인분 국물도 혼자 다 먹을 수 있음,양
1000237311,파 송송 썰어 넣고 하얀 쌀밥에 김치만 있음 끝,활용 방법
1000237311,좋은 재료에서 우러나오는 깔끔하면서도 깊은 감칠맛 간도 딱 맞았어요,맛/향/풍미
1000237311,입맛 까다로우신 남편도 엄치 척,맛/향/풍미
1000237311,마마리는 역시 다르네요,맛/향/풍미
1000237311,다음 번에도 곰탕을 쟁일 것 같아요 특가 기다립니당,보관
1000237311,아하 이런 게 감칠맛이라고 하는군요,맛/향/풍미
1000237311,고기도 넉넉하게 들어가 있는데,양
1000237311,고기가 도가니탕처럼 토실토실하고 말캉말캉 보드랍네요,양
1000237311,국물도 맑은 국물이고,맛/향/풍미
1000237311,이거 진짜 무슨 육수인지 너무 시원하고 맛있어여,맛/향/풍미
1000237311,고기 육수를 오래 끓여 낸 것인지 완전 깊은 맛,맛/향/풍미
1000237311,건강에도 좋을 것 같아요,맛/향/풍미
1000237311,무도 파도 들어가 있어서 밥 휘리릭 말아 먹기에도 딱이에요,활용 방법
1000237311,해동해서 냄비에 팔팔 끓이기만하면 되니까 차리기에도 진짜 간편하고요,활용 방법
1000237311,자주 사 먹을 것 같아요 품절될까 봐 쟁여 놔야겠어요,보관
1000237311,진한 국물이 좋습니다,맛/향/풍미
1000237311,고기가 조금 더 들어가면 좋겠습니다,양
1000237311,한 끼 맛있게 국밥으로 해결했습니다,맛/향/풍미
1000237311,국물 필요할 때 좋은데,활용 방법
1000237311,다른 집이 더 좋아요,맛/향/풍미
1000237311,아주 맛있게 먹었어요,맛/향/풍미
1000237311,무와 두부 더 넣고 끓여도 괜찮네요,활용 방법
1000237311,당면도 불려서 같이 끓였어요,활용 방법
1000237311,아침에 간단하게 끓여서 밥 말아서 먹기 너무 좋아요,활용 방법
1000237311,자극적이지 않고 맛있어요,맛/향/풍미
1000237311,완전 맛있어요,맛/향/풍미
1000237311,고기 푸짐하게 들어 있고,양
1000237311,국물이 끝내줘요,맛/향/풍미
1000237311,뜨끈한 국물 필요할 때 굿,활용 방법
1000237311,그냥 곰탕으로 먹어도 맛있지만,맛/향/풍미
1000237311,이번엔 무를 넣고 소고기 무 국으로 시원하고 맛있음,맛/향/풍미
1000237311,맛있어요,맛/향/풍미
1000237311,진짜 그 맛이에요,맛/향/풍미
1000237311,간 편식으로 깔끔하고 맛있어요,맛/향/풍미
1000237311,떡국 떡 넣어서 끓이면 간 편식 떡국이 뚝딱 완성,활용 방법
1000237311,항상 맛있어서 늘 주문하는 제품입니다,맛/향/풍미
1000237311,배송은 정확하고,포장/배송
1000237311,맛은 더 깔끔하고 진짜 맛있어요,맛/향/풍미
1000237311,재구매 입니다,보관
1000237311,감칠맛이 느껴지고 제 입맛엔 딱 좋아요,맛/향/풍미
1000237311,두 번 나눠 먹으면 적당한 양이예요,양
1000237311,찢어진 소고기가 좀 질겨요,맛/향/풍미
1000237311,국물이 개운하고 맛 있는데,맛/향/풍미
1000237311,고기 양이 많진 않네요,양
1000237311,맛있어요,맛/향/풍미
1000237311,봉지가 약해서,포장/배송
1000237311,냉동 상태의 봉지가 찍히고 그래요,포장/배송
1000237311,아이가 좋아해서 재 주문했어요,양
1000237311,고기 잡내도 많이 나지 않고,맛/향/풍미
1000237311,깔끔한 육수가 너무 맛있네요,맛/향/풍미
1000237311,전날 미리 냉장 실에 넣어서 해동해 두고 잤어요,보관
1000237311,아침에 휘리릭 끓여서 먹으려구요,활용 방법
1000237311,그냥 봉지 뜯고 끓이기만하니까 완성이라서 너무 좋았어요 5분 만에 아침 해결,활용 방법
1000237311,맛은 곰탕이라기보다는 갈비탕 같은 맛인데 아침에 해장용으로는 맑고 개운한 느낌이라 더 좋더라구요,맛/향/풍미
1000237311,고기도 양도 적당하고 질기거나 잡내 나는 거 없이 깔끔했어요,양
1000237311,국물 양도 넉넉해서 추가로 밥도 더 말아먹었습니다,양
1000237311,냉동실 쟁여템이 될 것 같아요,보관
1000237311,깊은 육수 맛이 저의 입맛과 너무 잘 맞아서 맛있게 잘 먹었어요,맛/향/풍미
1000237311,간이 너무 세지도 않아서,맛/향/풍미
1000237311,밥 한 그릇 호로록했네여,양
1000237311,다 먹고 남은 육수까지 다 흡입했어요,양
1000237311,든든하게 잘 먹었습니다,양
1000237311,냉동실에 쟁여 뒀다가 반찬 없을 때 아이들 줍니다,보관
1000237311,너무 좋아하네요,맛/향/풍미
1000237311,맛 있는데,맛/향/풍미
1000237311,양이 넘 적음,양
1000237311,맛이 꽤 괜찮네요,맛/향/풍미
1000237311,고기도 너무 퍽퍽하거나 질긴 느낌 없구요,맛/향/풍미
1000237311,재구매 의사 있습니다,보관
1000237311,맛있는 곰탕 반찬 없을 때 좋아요,활용 방법
1000237311,정말 맛있어요,맛/향/풍미
1000237311,국물이 진짜 끝내줍니다,맛/향/풍미
1000237311,미역국도 맛있는 데 곰탕도 정말 맛있네요,맛/향/풍미
1000237311,개인적으로나 주식 곰탕이 개운하고 맛있어요,맛/향/풍미
1000237311,여름에 불 쓰기도 어려운데 간단한 한 끼 좋아요,활용 방법
1000237311,맛 잇어서 매번 주문해서 먹어요,맛/향/풍미
1000237311,1인분 한 끼 식사로 먹기 좋아요,활용 방법
1000237311,고기도 아이들 먹기 좋은 사이즈라 만족스러워요,양
1000237311,할인해서 처음 사 봤어요,가격
1000237311,나주 곰탕이 먹기 편해요,활용 방법
1000237311,맑은 곰탕 떡국 베이스로도 맛있어요,맛/향/풍미
1000237311,국물 맛도 좋고,맛/향/풍미
1000237311,맛있어요,맛/향/풍미
1000237311,한 봉지 1 인이 먹기 딱 좋아요,양
1000237311,간이 강하지 않아서 밥이랑 먹기 딱 좋았어요,맛/향/풍미
1000237311,재구매 의사 있습니다,가격
1000237311,곰탕 맛있어요,맛/향/풍미
1000237311,와 진짜 맛있어요,맛/향/풍미
1000237311,포장도 진짜 꼼꼼하고 좋은데,포장/배송
1000237311,이거 참 맛있어요,맛/향/풍미
1000237311,반찬 없을 때 냉동실 서 꺼내 먹기 좋아요,활용 방법
1000237311,고기 양도 생각보다 많아요,양
1000237311,배송 답이 없네요,포장/배송
1000237311,자꾸 녹아서 배송되자 마자 받으려고 계속 확인 함,포장/배송
1000237311,조금 늦게 받았더라면 또 녹았을 듯,포장/배송
1000237311,대책이 필요해요,포장/배송
5057668,아침에 잘 받았다며 사진을 보내 주셨는데 다른 제품이더라구요,포장/배송
5057668,바로 카카오톡으로 문의했는데 반품 회수 후 해결해 주겠다는 앵무새 같은 답변뿐이네요,포장/배송
5057668,상식적으로 시댁 어르신께 오 배송됬다고,포장/배송
5057668,냉장고에서 빼서 다시 담고 박스 포장해서 집 앞에 놔 달라고 하는 게 가능한가요,포장/배송
5057668,컬리 정책상 반품 회수 후 도움 드릴 수 있다는 답변만 하네요,포장/배송
5057668,먼저 오 배송으로 실수를 한 건 컬리인데,포장/배송
5057668,왜 제가 불편함까지 감수하며 컬리에 정책을 따라야하는 건지,포장/배송
5057668,추석 선물 세트 상품인데 참 씁 슬 하네요,포장/배송
5057668,봉투 아랫부분에 구멍들이 뚫려서,포장/배송
5057668,스티로폼 박스에 국물에 샜어요,포장/배송
5057668,배송 상자를 좀 여유 있게 제작하시던지하셔야지,포장/배송
5057668,이렇게 꽉꽉 담아 꽁꽁 얼린 것들이 충격이나 뭐에 찢어질 수도 있다는 거 아셔야할 것 같네요,포장/배송
5057668,포장이 고급지고 좋다고,포장/배송
5057668,비싼 거 보냈다고 좋아하셨어요,가격
5057668,컬리에서 할인하고 쿠폰으로 저렴하게 구매해서 좋아요,가격
5057668,신랑이 좋아해서 재구매하는 제품 중 하나,보관
5057668,낱개로 11000원인데 선물 세트 4개 들은 게 할인을 크게 하길래 쟁여 두려고 주문했어요,가격
5057668,포장도 너무 예쁘게 와서 명절에 선물용으로 쓸 껄 그랬다는 생각이,포장/배송
5057668,국물은 같고 내용물이 도가니냐 고기냐 이 차이네요,맛/향/풍미
5057668,여기 곰탕 먹으면 다른 집은 물같이 느껴질 것 같아요,맛/향/풍미
5057668,차가운 상태엔 죽같이 걸 죽해요,맛/향/풍미
5057668,간이 아예 안 돼 있는 제품이라 기호에 맞게 간 조절할 수 있는 점도 좋네요,맛/향/풍미
5057668,후추랑 대파 소금 좀 넣고 끓이다가 밥이랑 김치랑 먹으니 몸보신이 따로 없어요,활용 방법
5057668,요즘같이 추운 날 강추템입니당,활용 방법
5057668,경복궁 도가니탕 곰탕 좋아하는데,맛/향/풍미
5057668,선물 세트도 이쁘네요,포장/배송
5057668,가격이 5000원 정도 싼 건 기분이 좀 그러네요,가격
5057668,어쨌든 곰탕보다는 도가니탕은 실속 있고 개운해요,맛/향/풍미
5057668,푸의 맛을 기대했으나 다른 맛,맛/향/풍미
5057668,도가니의 양은 적지 않음,양
5057668,국물은 거의 우유 빛깔,맛/향/풍미
5057668,국물이 쬐금 부족 뭔가하다는 개인적인 생각 입니다,양
5057668,귀퉁이 부분에서 내용물이 샜지만 아무래도 냉동 상태이다 보니 어디 부딪히면 금방 찢어지는 듯해요,포장/배송
5057668,컬리에서 다 잘 처리해 주셨습니다,포장/배송
5057668,포장이 개선되면 좋을 거 같아요,포장/배송
5057668,국물이 진하고 맛 있어요,맛/향/풍미
5057668,저 이거 두 박스 주문했는데 한 박스만 왔어요,포장/배송
5057668,도넛 박스가 다 젖어서 도넛도 조금 젖었,포장/배송
5057668,배송 시 케이스 이렇게 와요,포장/배송
5057668,맛있길 기대함,맛/향/풍미
5057668,곰탕은 살짝 분유 맛이 나는 것 같은 느낌과 너무 하얀 국물,맛/향/풍미
5057668,도가니는 생각보다 많이 들어 있어요,양
5057668,가격대 비 만족합니다,가격
5057668,너무 이상한 맛입니다,맛/향/풍미
5057668,국물이 분유 탄 거 같이 찝찝하네요,맛/향/풍미
5057668,이런 곰국은 처음이네요,맛/향/풍미
5057668,애들이 이상하다고 안 먹는 데다 저도 찝찝해서 버렸습니다,맛/향/풍미
5057668,포장이 잘 되어 왔어요,포장/배송
5057668,사골 분말처럼 넘 하햫네요,맛/향/풍미
5057668,고기 딱 두 점 들어 있구요,양
5057668,시중에 사골 국물 더 맛있는 것도 많은데 별로네요,맛/향/풍미
5057668,엄청 진하다고 하시네요,맛/향/풍미
5057668,전에 경복궁 도가니탕 넘 맛있게 먹었는데,맛/향/풍미
5057668,구성 넘 좋아요,양
5057668,해동해서 데워 먹기 좋아욯,활용 방법
5057668,냉동실에 쟁여 놓으면 너무 든든합니다,보관
5057668,남편 아침 퇴근 시 딱 좋아요,활용 방법
5057668,국물이 진하고 맛있어서 계속 시켜 먹고 있어요,맛/향/풍미
5057668,한 봉지가 터져서 줄줄 흐른 상태로 되어 있네요,포장/배송
5057668,환불 속도도 너무 느려서 아직도 처리가 안 됐네요,포장/배송
5057668,회수 절차 필요하다고 해서 굳이 또 재포장해서 밖에 며칠씩 두고 너무 번거롭고,포장/배송
5057668,경험이 최악이라 절대 다시 주문 안 합니다,포장/배송
5057668,국물이 진하고 맛있어서,맛/향/풍미
5057668,도가니는 엄청 많아요,양
5057668,국물은 진하긴한데 개인적으로 썩 맛있다는 느낌은 아니네요,맛/향/풍미
5057668,경 족 궁 사골 도가니탕 맛있어서 자주 구매하는 게,맛/향/풍미
5057668,곰탕도 맛있겠죠,맛/향/풍미
5057668,진하고 맛있게 잘 먹었습니다,맛/향/풍미
5057668,실속 있어요,가격
5057668,4개가 할인이 많이 되어 좋아요,가격
5057668,맛있구요,맛/향/풍미
5057668,포장도 잘 되 있어서 선물용으로 딱입니다,포장/배송
5057668,도가니도 엄청 많이 들어 있고,양
5057668,국물도 진해서 너무 애용합니다,맛/향/풍미
5057668,얇디 얇은 고기가 달랑 두 개 있네요,양
5057668,이건 좀 아쉽습니다,양
5057668,고기 곰탕은 도가니탕보다 유통 기한이 좀 짧네요,보관
5057668,좋은 가격에 구매해서 더 좋네요,가격
5029746,물건 받고 냉장 식품이라 넣어 두고 잘려구 요,보관
5029746,아이스팩이 구멍이 나서 박스는 다 젖은 채로 배송이 됐네요,포장/배송
5029746,배송 때문에 냉장 냉동식품 시키기가 꺼려집니다,포장/배송
5029746,진짜 사골 국물이 맞는 건지 의심스러워요,맛/향/풍미
5029746,뽀얀 국물이 아니라 완전 밀가루 색임,맛/향/풍미
5029746,건더기가 없어서 집에 샤브 고기가 있어서 같이 끓였더니,양
5029746,국물 색이 물색으로 변해서 너무 놀라서 다 버렸어,양
5029746,저렴해서 한 끼 맛있게 먹자 시켰는데,가격
5029746,사골 국물은 진짜 아니네요,맛/향/풍미
5029746,첨가물 없이 고아서 만든 거 같아요,맛/향/풍미
5029746,소금 간이 없어 좋아요,맛/향/풍미
5029746,만두국 해 먹기 좋아요,활용 방법
5029746,고기는 안 들어 있어요,양
5029746,맛 잇네요,맛/향/풍미
5029746,국물 요 추천,활용 방법
5029746,국물이 진하고,맛/향/풍미
5029746,냄새가 나지 않아서 잘 먹었습니다,맛/향/풍미
5029746,간이 안 되어 있어 좋아요,맛/향/풍미
5029746,간되어 있는 건 조미료 맛이 나서 싫어해요,맛/향/풍미
5029746,국물이 뽀얀 진한 사골 국 이네요,맛/향/풍미
5029746,만두국해서 든든하게 먹었어요,활용 방법
5029746,소금 간은 따로 해야해요,맛/향/풍미
5029746,만두국 해 먹는 데 썼어요,활용 방법
5029746,국물이 진하고 맛있어요,맛/향/풍미
5029746,진한 사골 국물 좋네요,맛/향/풍미
5029746,떡국 베이스로 사용하니 좋아요,활용 방법
5029746,고소합니다,맛/향/풍미
5029746,아침으로 떡국 먹을 때 빠르게 끓일 수 있어서 편해요,활용 방법
5029746,진한 사골 곰탕 맛있어요,맛/향/풍미
5029746,아이 사골 국 간단히 주기 좋음,활용 방법
5029746,진하고 고소해요,맛/향/풍미
5029746,사골 곰탕이 아주 진하고 좋아요,맛/향/풍미
5029746,곰탕의 구수한 맛이 없네요,맛/향/풍미
5029746,진한 사골 곰탕이라는 상품명처럼 진하고 맛있어요,맛/향/풍미
5029746,첨가물 없이 깔끔해서 좋네요,맛/향/풍미
5029746,밥을 말아서 먹으면 맛있습니다,활용 방법
5029746,국물이 아주 뽀얗고 고소해요,맛/향/풍미
5029746,뽀얀 국물이 네 용,맛/향/풍미
5029746,냄새 적어서 좋아요,맛/향/풍미
5029746,석박지랑 먹으니 아주 맛있어요,맛/향/풍미
5029746,밥 말아서 먹으면 맛있습니다,활용 방법
5029746,떡국할 때 만두국할 때 간편해요,활용 방법
5029746,양도 꽤 넉넉하고,양
5029746,맛있어요,맛/향/풍미
5029746,아기도 잘 먹어요,활용 방법
5029746,맛있게 잘 끓여 먹었어요,맛/향/풍미
5029746,늘 쟁여 놓고 먹,보관
5029746,사골 중 으뜸,맛/향/풍미
5029746,농협이라 믿고 먹을 수 있어요,맛/향/풍미
5029746,가격 좋고,가격
5029746,한 끼 먹기에 맛도 괜찮네요,맛/향/풍미
5029746,진하고 국물 맛이 끝내줘요,맛/향/풍미
5029746,유통 기한이 길어서 좋아요,보관
5029746,제대로 된 사골 곰탕 국물이었습니다,맛/향/풍미
5029746,재구매하고 싶어요,가격
5029746,뽀얀 국물이,맛/향/풍미
5029746,좀 비싸지만,가격
5029746,이번 건 좀 별루 래용,맛/향/풍미
5029746,크림 같은 맛이 난다,맛/향/풍미
5029746,아주 찐한 곰국은 아니지만,맛/향/풍미
5029746,고소해요,맛/향/풍미
5029746,냄새도 안 나고,맛/향/풍미
5029746,맛있어요,맛/향/풍미
5029746,가성비 대비,가격
5049679,고기는 냄새 나고,맛/향/풍미
5049679,국물에 비지는 얼마 없어요,양
5049679,이거는 정말 별로네요,맛/향/풍미
5049679,강력 비추입니다,맛/향/풍미
5049679,국물만 흥건하고 비지는 별로 없는,양
5049679,너무 맛이 없는 찌게인지 국인지 모르겠습니다,맛/향/풍미
5049679,이건 몇 번 사 먹는 중이에요,보관
5049679,식당보다 맛있어서,맛/향/풍미
5049679,오래오래 팔아 주세요,가격
5049679,텁텁함만 더해졌고,맛/향/풍미
5049679,돈 아깝네뇨,가격
5049679,비지찌개가 아니라 비지국이네요,맛/향/풍미
5049679,재주문은 안 할 것 같아요,가격
5049679,색깔은 너무 맛있어 보였는데,맛/향/풍미
5049679,콩비지가 너무 조금 들어가고,양
5049679,김치만 많이 들어갔는데 그조차도 덜 익은 김치인지,맛/향/풍미
5049679,맛 자체가 깊지 않고 싱거워서밍숭맹숭해요,맛/향/풍미
5049679,아쉽네요,맛/향/풍미
5049679,내용물이 비지도 많지 않고 김치도 많지 않아,양
5049679,남는 두부 하나 넣어 먹었어요,활용 방법
5049679,가격은 내용물에 비해 비싼 듯 하지만,가격
5049679,냉동으로 오래 보관 가능하고,보관
5049679,부족하지 않게 김치랑 고기가 씹히고 맛있음,맛/향/풍미
5049679,4번째 구매,보관
5049679,찌개가 아니라 국 인데요,맛/향/풍미
5049679,두부를 더 넣어도 너무 묽어요,양
5049679,비지가 너무 없어서,양
