product_id,review,category
1000605720,달걀 하나 넣어 먹으면 더 좋았을 듯 해요,활용 방법
1000605720,순두부가 있어 부드러운 짬뽕 탕이 되네요,맛/향/풍미
1000605720,국물은 시원한데,맛/향/풍미
1000605720,제 입맛에는 그닥이라,맛/향/풍미
1000605720,그래도 맛있게 한 끼 먹었어요,맛/향/풍미
1000605720,칼칼하니 짬뽕 맛나고 맛있네요,맛/향/풍미
1000605720,해물 더 넣어 끓였더니 엄지 척,활용 방법
1000605720,예상했던 거 보다 맛있어요,맛/향/풍미
1000605720,해산물만 싯 어서 육수 부어서 편하구요,활용 방법
1000605720,물 따로 안 넣구 육수만 부어서 그게 제일 편해요,활용 방법
1000605720,요리 난이도 하 수준이라 메뉴얼 보고 아무나 쉽게 요리할 수 있는 밀키트에요,활용 방법
1000605720,순두부찌개 좋아하시는 분은 좋아할 맛이에요,맛/향/풍미
1000605720,이비가 매장에서 먹는 국물 맛은 아니였지만 충분히 맛있었고,맛/향/풍미
1000605720,재구매 의사 있습니다,활용 방법
1000605720,순두부 짬뽕 얼큰하고 맛있는 데,맛/향/풍미
1000605720,목이버섯은 미리 좀 불려서 요리해야할 거 같아요,활용 방법
1000605720,맛있었어요,맛/향/풍미
1000605720,아쉬운 점은 바지락은 해감 제다로 안됐고,양
1000605720,살도 없는 편이라 육수용으로 생각하심 좋을 듯 해요,양
1000605720,깔끔하게 포장되어 있어서 캠핑 가서 해장용으로 먹기 괜찮을 거 같아요,포장/배송
1000605720,순두부찌개 맛보다는 짬뽕의 맛이 더 잘 났던 거 같아요,맛/향/풍미
1000605720,맵지 않지만 시원 칼칼하고 많이 자극적이지 않아요,맛/향/풍미
1000605720,짬뽕 맛이 진하고 맛있어요,맛/향/풍미
1000605720,아참 해장용으로 아주 편리하네요,활용 방법
1000605720,맛도 내용도 괜찮습니다,맛/향/풍미
1000605720,순두부 더 추가해서 푸짐하게 먹어도 좋습니다,양
1000605720,짬뽕이라고 하기엔 많이 순함,맛/향/풍미
1000605720,순두부 찌게 느낌,맛/향/풍미
1000605720,조금 싱거워요,맛/향/풍미
1000605720,육수도 들어 있는데 좀 짜서,맛/향/풍미
1000605720,기호에 따라 물 좀 넣어도 될 거 같아요,맛/향/풍미
1000605720,중학교 애들이 맛있게 먹었네요,맛/향/풍미
1000605720,유통 기한이 짧아 대충 6일 안에는 해서 먹어야 되요,보관
1000605720,재료만 짬뽕이고,맛/향/풍미
1000605720,짬뽕 맛은 전혀 못 느끼겠어요,맛/향/풍미
1000605720,조리법대로 했는데,활용 방법
1000605720,별로입니다,맛/향/풍미
1000605720,이름대로 짬뽕에 순두부 넣은 맛 약간 톡 쏘는 매운 맛이 칼칼하고 괜찮네요,맛/향/풍미
1000605720,해물이랑 야채류 추가해서 끓이니 간도 조금 순해지고,맛/향/풍미
1000605720,반찬으로 먹기 좋아요,활용 방법
1000605720,그래도 다음엔 북동 순두부로 돌아갈 예정,활용 방법
1000605720,짬뽕 맛이 다른 곳 거보다는 조금 약한 것 같아요,맛/향/풍미
1000605720,맛이 궁금해서 사 봤어요,맛/향/풍미
1000605720,간편하고 맛있게 먹어서,맛/향/풍미
1000605720,간 편식으로 한 끼 때우기에 너무 편하고,활용 방법
1000605720,맛있어요,맛/향/풍미
1000605720,레시피 띠라 만들기도 쉽고,활용 방법
1000605720,약간 매콤하긴한데 맛나요,맛/향/풍미
1000605720,2 인은 충분히 먹을 수 있는 양이라,양
1000605720,가성비 좋음,가격
1000605720,나는 맛있게 먹고,맛/향/풍미
1000605720,아이는 별로라 하고,맛/향/풍미
1000605720,국물 시원하고 매콤한 게 맛있어요,맛/향/풍미
1000605720,짬뽕 순두부 얼큰하고 맛있어요,맛/향/풍미
1000605720,짬뽕 순두부 간편해서 좋아요,활용 방법
1000605720,맛이 괜찮아요,맛/향/풍미
1000605720,짬뽕 맛 적당함,맛/향/풍미
1000605720,맛있게 잘 먹었습니다,맛/향/풍미
1000605720,물의 양이 넘 적어서,양
1000605720,오징어 전복 새우 추가했어요,활용 방법
1000605720,이 비가 짬뽕 좋아하는데,맛/향/풍미
1000605720,맛있기를 기대해 봅니다,맛/향/풍미
1000605720,맛이 괜찮은 편이라,맛/향/풍미
1000605720,세일 때 가끔 사요,가격
1000605720,맛있었어요,맛/향/풍미
1000605720,2 인이 먹기 괜찮았어요,양
1000605720,후기 쓰고 재구매했어요,보관
1000605720,짬뽕에 순두부 넣은 맛입니다,맛/향/풍미
1000605720,조금 더 얼큰하면 좋을 것 같아서 청양고추 추가해서 먹었습니다,맛/향/풍미
1000605720,내용물도 실하고 맛있는 데,양
1000605720,보냉 팩이 터졌는지 박스가 물이 뚝뚝 떨어져서,포장/배송
1000367308,한 숟갈 먹자마자 누린내에 역해서 못 먹고 바로 다 버렸습니다,맛/향/풍미
1000367308,진짜 평생 먹어 본 곱창전골 중 최악이네요,맛/향/풍미
1000367308,냄새 납니다,맛/향/풍미
1000367308,가격도 비싸고,가격
1000367308,가격이 더 비싸길래 내용물이나 만족도가 더 높겠지 하고 구매했는데 실망스럽네요,가격
1000367308,밍밍하고,맛/향/풍미
1000367308,내용물도 부실해요,양
1000367308,생각보다 맛있고 깔끔합니다,맛/향/풍미
1000367308,기름두 잘 제거했구요,맛/향/풍미
1000367308,버섯을 더 추가해서 끓여서 저녁 한 끼 잘 먹었어요,활용 방법
1000367308,맛이 좋아,맛/향/풍미
1000367308,1 팩 더 주문하려구요,보관
1000367308,적당히 얼큰하고 깊은 맛이 완벽해서,맛/향/풍미
1000367308,맛은 있어요,맛/향/풍미
1000367308,미나리 추가해서 먹으니 더 좋아요,활용 방법
1000367308,국물 맛이 좋아요,맛/향/풍미
1000367308,성인 2 인이 버섯 깻잎 추가해서 한 번 먹고,양
1000367308,다음날 대패 삼 겹 추가해서 또 한 번 더 푸짐하게 먹었어요,양
1000367308,건더기 푸짐하고 두 끼 정도 먹는 양이예요,양
1000367308,끓이면서 약간 냄새가 나는가 했는데 먹어 보니 괜찮 앗어요,맛/향/풍미
1000367308,맛있어서 꾸준히 주문합니다,맛/향/풍미
1000367308,버섯과 두부를 추가해서 끓여 주니 맛있어요,활용 방법
1000367308,국물 양은 많은데 건더기는 별로 없어요,양
1000367308,곱창보다는 천엽 같은 다른 내 장류가 더 많아요,양
1000367308,배추 같은 것도 좀 적어서,양
1000367308,2인분이 될까 했는데 15인분 정도 인 거 같아요,양
1000367308,재구매 의사 x,가격
1000367308,냄새에 예민한데 괜찬네요,맛/향/풍미
1000367308,건더기는 먹을 만큼 들어 있고,양
1000367308,우동 사리 넣어 먹음 딱 좋을 듯 해요,활용 방법
1000367308,국 탕류 좋아해서 자주 먹는데 신제품이라 사 봤어요,활용 방법
1000367308,비싸서 고민은 했는데,가격
1000367308,양이 많아서 좋아요,양
1000367308,보통 사는 국탕류 양의 두세 배 되네요,양
1000367308,특히 건더기가 풍성하고 배추가 많아서,양
1000367308,국물 시원해요,맛/향/풍미
1000367308,국물 땡기는 날 담에 또 사 먹을 거 같아요,활용 방법
1000367308,양이 너무 적어요,양
1000367308,곱창 구경하기 힘들었어요,양
1000367308,와우 너무 깔끔 담백하니 추천하고 싶어요,맛/향/풍미
1000367308,추가로 당면이랑 깻잎만 넣고 먹었는데 두 사람에 푸짐하게 잘 먹었어요,양
1000367308,다른 조미료 굳이 필요 없이 고소하고 맛있었어요,맛/향/풍미
1000367308,재구매 의사 있습니다,가격
1000367308,다양한 야채 버섯 넣어 먹을 만하게 먹긴 했어요,활용 방법
1000367308,살짝 냄새에 예민하신 분은 피하시길,맛/향/풍미
1000367308,구수하고 자극 없이 먹을 만해요,맛/향/풍미
1000367308,내용물이 푸짐하고,양
1000367308,국물도 맛있어요,맛/향/풍미
1000367308,세일 하면 또 사야겠어요,가격
1000367308,너무 맛 잇게 먹었어요,맛/향/풍미
1000367308,오발탄 음식은 모든 게 맛있어요,맛/향/풍미
1000367308,포장이 가위로 잘려 있었음,포장/배송
1000367308,냉장고에서 해동시켰는데 냉장고에 뭐가 다 질질 흘러 있길래 봤더니,포장/배송
1000367308,국물 질질 다 흘러 있었어요,포장/배송
1000367308,오발탄 곱창 추가해서 맛있게 먹어요,맛/향/풍미
1000367308,우거지가 진짜 맛있어요,맛/향/풍미
1000367308,국물도 맛있네요,맛/향/풍미
1000367308,맛있어서 연달아 3번째 구매입니다,맛/향/풍미
1000367308,곱창전골은 너무 좋아하는데,맛/향/풍미
1000367308,너무 맛있는 거예요,맛/향/풍미
1000367308,곱창이랑 양도 많고,양
1000367308,기분 좋을 만큼 매콤한 맛,맛/향/풍미
1000367308,다 먹고 남은 국물에는 차돌박이랑 우동 면 넣어서 아주 깔끔하게 국물까지 완벽하게 먹었답니다,활용 방법
1000367308,넘 맛있어서 바로 재구매했어요,맛/향/풍미
1000367308,남은 국물에는 우동 사리 넣고 먹으려고요,활용 방법
1000367308,내용물이 적당합니다,양
1000367308,맛이 괜찮습니다,맛/향/풍미
1000367308,고소하니 얼큰하고 맛있네요,맛/향/풍미
1000367308,맛은 오발탄이 아니라 정발 탄,맛/향/풍미
1000367308,양 많고 푸짐해요,양
1000367308,넷이서 먹어도 될 듯,양
1000367308,캠핑 갈 때 한 팩 챙겨 가면 유용하겠어요,활용 방법
1000367308,국물 시원하고 개운합니다,맛/향/풍미
1000367308,소주 안주로도 담 날해 장으로도 굿,활용 방법
1000367308,아침에 받아서 국이 없길래 바로 끓였어요,활용 방법
1000367308,맛있죠 뭐,맛/향/풍미
1000367308,맛있다 그래서 재구매했어요,맛/향/풍미
1000367308,냉동이라 보관하기도 좋고,보관
1000367308,양도 많아서 괜찮네요,양
1000367308,내용물도 많고 국물 맛이 진하고 너무 맛있어요,맛/향/풍미
1000367308,양이랑 내장이랑 모두 부드럽고 냄새 하나도 안 나요,양
1000367308,국물 한 방울 안 남기고 싹싹 비워 먹었네요,양
1000367308,매운 걸 전혀 못 먹는 사람 외에는 맛있게 매콤한 맛이 있어서,맛/향/풍미
1000367308,저도 매운 걸 잘 못 먹는데 맵다는 생각 전혀 안 들고,맛/향/풍미
1000367308,아주 구수한 맛까지 더해져서 너무 맛있게 자알 먹었습니다,맛/향/풍미
1000367308,바로 재구매 들어갔어요,보관
1000367308,저의 최애로 등록 완료,보관
1000367308,소 곱창 건더기도 푸짐하게 들어 있고,양
1000367308,채소도 풍부하게 맛이 좋습니다,맛/향/풍미
1000367308,대파 좀 더 썰어 넣고 보글보글 끓여서 먹으니 한 끼 식사로 든든합니다,활용 방법
1000367308,냉동실에 쟁여 두고 싶어요,보관
1000367308,국물이 좀 짜서 각종 야채를 더 넣으니 딱 좋았고,맛/향/풍미
1000367308,양도 두 명이 충분히 먹기에 괜찮은 거 보니,양
1000367308,야채 추가 추천,활용 방법
1000367308,국물 맛  완전 굿,맛/향/풍미
1000367308,내장 맛  만족스러움 맛있음,맛/향/풍미
1000367308,냉동 같지 않음,맛/향/풍미
1000367308,맛있지만 할인할 때 사면 좋을 듯,가격
1000367308,가족들 너무 좋아해요,맛/향/풍미
1000367308,맛있어요,맛/향/풍미
1000367308,후기가 좋고 가격도 할인하기에 구매했어요,가격
1000367308,잡냄새 없이 맛있었습니다,맛/향/풍미
1000367308,간은 조금 짠 듯해서 물을 좀 추가했습니다,맛/향/풍미
5132868,너무너무 맛있어요,맛/향/풍미
5132868,육수도 1리터 정도나 나와서,양
5132868,물 조금 더 넣고,활용 방법
5132868,기호에 따라 원하는 재료 넣어서 끓여 먹으면 푸짐하고 맛있습니다,활용 방법
5132868,대파와 시치미도 첨가했어요,활용 방법
5132868,유부 안에 야채 당면이 빵빵 푸짐해서 식감도 짱이고,양
5132868,육수도 진짜 맛있네요,맛/향/풍미
5132868,어묵탕이나 전골 요리에 꼭 넣어 먹어 보세요,활용 방법
5132868,중독성 강한 요물 유부 주머니로 만들어 먹은,맛/향/풍미
5132868,맛이 꽤 좋아서 아이들이 좋아라 먹더라구요,맛/향/풍미
5132868,모든 음식에 유부 주머니를 넣고 싶을 정도로 맛이 괜츈합니다,맛/향/풍미
5132868,해동 따로 필요 없이 유부 주머니는 나중에 4분 정도만 끓여 주면 끝,활용 방법
5132868,어디에도 잘 어울리는 맛입니다,맛/향/풍미
5132868,유부 주머니 하나 들어갔을 뿐인데 비주얼과 맛이 달라져서 아이들이 좋아라 합니다,맛/향/풍미
5132868,유부 주머니가 빠지면 허전한 그림이 되죠,맛/향/풍미
5132868,중학생 때 먹던 김 말이랑 떡볶이,맛/향/풍미
5132868,약간 김 말이 맛 느낌이 나더라구요,맛/향/풍미
5132868,찌개 전골 국 요리 어디에도 잘 어울려요,맛/향/풍미
5132868,속이 꽉 찬 유부 주머니 강추 해 봅니다,맛/향/풍미
5132868,안에 고기 브로콜리 당근 버섯 아주 작게 들어 있어요,양
5132868,버섯 향이 나요,맛/향/풍미
5132868,넘 괜찮은데요,맛/향/풍미
5132868,가쓰오부시 소스 한 봉 들어 있구요,맛/향/풍미
5132868,매콤하게 매운 건고추 넣고,활용 방법
5132868,국물 지저분해지지 않도록 통마늘 한 줌,활용 방법
5132868,대파도 통으로 구워서 넣었구요,활용 방법
5132868,마지막에 후추 팍팍 뿌렸더니,활용 방법
5132868,왜케 맛있죠,맛/향/풍미
5132868,미친 맛,맛/향/풍미
5132868,삶은 반숙 란 넣고 싶었는데 귀찮아서 패스,활용 방법
5132868,이것도 넣어서 노른자 마지막에 국물에 풀어 먹으멱 끝 나겠네요,활용 방법
5132868,완전 해동하면 묶은 미나리 부추 여튼 묶은 게 다 풀리네요,양
5132868,살짝 덜 해동된 상태로 끓였는데 터지진 않았지만 묶은 게 다 풀려서 이쁘게 되진 않아요,양
5132868,맛도 너무 기대를 했는지 좀 그랬어요,맛/향/풍미
5132868,어묵 국에 추가해서 넣어 먹으려 샀는데,활용 방법
5132868,금방 풀어지니까 너무 오래 끓이면 안 되요,활용 방법
5132868,어묵탕에 같이 넣어 먹었는데 맛있어요,맛/향/풍미
5132868,맛있어요,맛/향/풍미
5132868,조금 푸짐하게 먹고 싶어 넣었는데,양
5132868,간도 딱이고 맛있어요,맛/향/풍미
5132868,어묵탕에 같이 끓여 먹기 좋아서,활용 방법
5132868,유부 주머니 8개 육스소스 2 봉지 들어 있습니다,양
5132868,맛은 타사 유부 주머니와 비슷해요,맛/향/풍미
5132868,부산 깡통 시장에서 먹었던 그 맛일까 궁금해 주문했어요,맛/향/풍미
5132868,맛있긴한데 재구매할 정도는 아닌 것 같아요,맛/향/풍미
5132868,맛도 괜찮구,맛/향/풍미
5132868,우동이나 어묵탕에 같이 넣으니 맛있네요,활용 방법
5132868,어묵탕에 넣어도,활용 방법
5132868,각종 탕 종류에 넣어도 일품,활용 방법
5132868,간이 잘 맞아 좋아요,맛/향/풍미
5132868,맛은 정말 맛있어요,맛/향/풍미
5132868,다 들 국물 맛이 끝내준다,맛/향/풍미
5132868,깔끔하고 누구나 다 아는 맛이에요,맛/향/풍미
5132868,유부 주머니 안에 너무 당면밖에 없었어요,양
5132868,겉 포장 없이 그냥 오네요,포장/배송
5132868,해동하니 너무 찝찝하더라구요,포장/배송
5132868,축축해져 가지고,포장/배송
5132868,오 맛 잇네요,맛/향/풍미
5132868,푹 끓이니까 국물이 찐임,맛/향/풍미
5132868,유부 주머니 8개 들어 있었어요,양
5132868,어묵 꼬지 넣고 끓이니 근사한 한 끼가 되었네요,활용 방법
5132868,부산 깡통 유부 주머니 포장이 푸짐하게,포장/배송
5132868,조금만 더 푸짐하게 먹고 싶어서 집에 있는 재료로 더욱 풍성하게 먹었습니다,양
5132868,밑 국물용 육수 팩이 간이 딱 맞아 떨어집니다,맛/향/풍미
5132868,이게 가족들 먹기에도 너무 너무 맛있는 요리 메뉴에요,맛/향/풍미
5132868,간편하게 술 한잔 하고 싶을 때 이거 하나 놓고 다른 거 필요 없이 한 팟에 내놓으면 딱 좋더라구요,활용 방법
5132868,가성비 끝판입니다,가격
5132868,요고 요고 냉동실 하나씩 비축해야 됩니다,보관
5132868,개당 천 원이 넘는 꼴이니 가성비는 안 좋다,가격
5132868,사이즈가 큰 편이고 끓이면 불어서 조금 더 커져요,양
5132868,곤약 면 버섯 대파 추가했어요,활용 방법
5132868,속 국물 베이스는 카라맬 색소 짙은 싸구려 조미료 풍미라,맛/향/풍미
5132868,약간만 넣고 나머지는 집에 있는 일제 가츠오부시 쯔유로 간 맞췄어요,활용 방법
5132868,7분 정도 끓이면 좋고 너무 오래 끓이면 당면이 너무 불어 터지고 멋 없으니 참고 하세요,활용 방법
5132868,맛이 별로라네요,맛/향/풍미
5132868,국물에 들어가면 다 터져요,양
5132868,와 이거 별미에요,맛/향/풍미
5132868,유부 주머니를 좋아해서 사 봤는데 완전 만족입니다,맛/향/풍미
5132868,부추는 있길래 추가했는데 그대로도 맛있어요,맛/향/풍미
5132868,맛있어요,맛/향/풍미
5132868,양도 은근 많아서 두 번 나눠 먹을 수 잇어요,양
5132868,유부 주머니 직접 만들려면 귀찮고 손만 많이 가는데,활용 방법
5132868,또 가끔 생각 나는 별 것도 아닌데,활용 방법
5132868,그냥 육수에 툭툭 넣고 끓이면 어묵탕하고는 또 다른 매력의 요리,활용 방법
5132868,어묵탕에 같이 넣어 먹으니 맛있어요,맛/향/풍미
5132868,속도 꽉 차서 아이들도 잘 먹어요,양
5132868,샤브샤브 요리 할 때 같이 넣어서 먹으면 좋아요,활용 방법
5132868,후기들이 매우 좋아서 구매했어요,활용 방법
5132868,어묵탕 끓이면서 유부 주머니 넣었어요,활용 방법
5132868,속이 꽉 찬 유부 주머니,양
5132868,정말 맛있어요,맛/향/풍미
5132868,어묵 추가해서 먹었어요,활용 방법
5132868,유부주머니 양도 실하고,양
5132868,맛있어요,맛/향/풍미
5132868,유부 주머니가 어묵탕의 품격을 올려 주네요,맛/향/풍미
5132868,맛있어요,맛/향/풍미
5132868,뭔가 작은 갈색 덩어리를 씹었는데 좀 이상한 향이 났어요,맛/향/풍미
5132868,대체로 맛있는 데 그 덩어리를 또 씹게 될까 봐 먹기가 살짝 무서워요,맛/향/풍미
5132868,부드럽고 맛있어요,맛/향/풍미
5132868,깡통 시장이 생각나는 맛입니다,맛/향/풍미
5132868,따뜻한 국물 땡길 때 좋아요,활용 방법
5132868,예쁘고 맛있어요,맛/향/풍미
5132868,파 썰어서 먹으니 더 좋았습니다,활용 방법
5132868,어묵탕 국물보단 살짝 슴슴하게 먹기 좋아요,맛/향/풍미
5132868,꽤 크더라고요,양
5132868,4 인 가족이서 국 대용으로 간단하게 먹으려고 샀는데 크고 통통해서,양
5132868,충분히 배가 차요,양
5132868,해동 조리법에는 해야한다고 적혀 있었는데 안 했어요,보관
5132868,그래도 잘 묶여 있어서 풀리지 않았고 속이 뜨거울 정도로 잘 데워졌어요,보관
5132868,생각보다 형광 맛이 났다,맛/향/풍미
5132868,양은 많았음,양
5132868,어묵탕 끓일 때 같이 넣었어요,활용 방법
5132868,부산에서 먹던 맛 그대로네요,맛/향/풍미
5132868,유부 주머니 좋아해서 늘 쟁여 놓아요,보관
5132868,여기저기 활용하기 좋아요,활용 방법
5132868,양이 상당하네요,양
5132868,당면만 들어 있어 심심하구요,맛/향/풍미
5132868,어묵이나 우동 사리 넣고 끓여 셋이 먹으면 딱 좋겠어요,활용 방법
5132868,우동 추가해서 먹었어요,활용 방법
5132868,너무 많이 사 먹어서 좀 질린 듯,맛/향/풍미
5132868,당분간 이건 좀 쉬어야겠어요,활용 방법
5132868,겨울에 먹기 너무 좋아요,활용 방법
5132868,술안주로 좋을 것 같아요,활용 방법
5132868,유부 주머니 맛나게 먹었어요,맛/향/풍미
5132868,오뎅 탕 유사하게 만들었네요,활용 방법
5132868,담에 또 구매 의사 있음,보관
5132868,편하고 맛있어서 지인 집에 해 먹었는데,활용 방법
5132868,역시나 맛있게 잘 먹었네요,맛/향/풍미
5132868,추울 때 이만한 게 없어요,활용 방법
5132868,18개월 아가들도 오뎅을 너무 잘 먹어요,양
5132868,실제 깡통 시장 유부 주머니 맛이랑 많이 달라서 별로예요,맛/향/풍미
1000047929,캠핑 가서 진짜 맛있게 먹었어요,활용 방법
1000047929,양이 부족할 것 같아서 물놀이 하고 간식 겸 안주용으로 끓였는데 너무 맛있었어요,양
1000047929,요게 감칠맛이 나는 것 같고,맛/향/풍미
1000047929,김치가 많이 들어가는 걸 좋아해서 가져간 김치도 조금 추가하고 얼큰하게 먹고 싶어서 청양고추 하나 썰어 넣었는데 진짜 너무 맛있었어요,활용 방법
1000047929,국물 진짜 대박,맛/향/풍미
1000047929,다음 캠핑에도 챙겨 가야겠어용,보관
1000047929,진짜 사고 싶었던 삼진 어묵 김치 어묵 전골입니다,보관
1000047929,너무너무 맛있고 근사한 한 끼를 완전 간편하게 즐길 수 있었어요,활용 방법
1000047929,삼진 어묵은 맛 보장 어묵이잖아요,맛/향/풍미
1000047929,오동동하고 큼지막한 어묵이 7개나 들어 있었는데요,양
1000047929,탱글탱글 쫄깃쫄깃해서 씹는 맛이 너무 좋았구요,맛/향/풍미
1000047929,부드러운 편이어서 아이들이 먹기에도 좋았어요,맛/향/풍미
1000047929,진짜 쫄깃쫄깃 했구요,맛/향/풍미
1000047929,어묵 국물이 얼큰하고 맵지는 않은 편입니다,맛/향/풍미
1000047929,감칠맛이 너무 좋아서 자꾸 마시고 싶어진달까요,맛/향/풍미
1000047929,겨울 냉동실 필수 쟁여템이랄까요,보관
1000047929,간편하게 맛있게 즐길 수 있을 것 같아요,활용 방법
1000047929,진짜 아주 아주 맛이 좋습니다,맛/향/풍미
1000047929,진짜 밀 키트 중에 역대 급 맛있습니다,맛/향/풍미
1000047929,김치는 딱 신 맛 단 맛 적당했습니다,맛/향/풍미
1000047929,어묵 면에 진짜 간이 잘 베어요,맛/향/풍미
1000047929,막 넣어도 식당에서 먹는 맛이 된다고요,맛/향/풍미
1000047929,맵기도 적당하고,맛/향/풍미
1000047929,국물이 끝내줍니다,맛/향/풍미
1000047929,양은 2인분이라고 적혀 있었지만,양
1000047929,대식가인 저로서는 살짝 아쉬웠어요,양
1000047929,혼자 먹는다고 부족한 정도는 아니고,양
1000047929,엄청 배부른 1 인분이었습니다,양
1000047929,어묵 양도 엄청 많았고 특히 다양했어요,양
1000047929,이것 저것 골라 먹을 수 있어서 넘 행복했습니다,양
1000047929,고래 사 김치 우동이 볶은 김치를 활용한 전골 느낌이라면 삼진 어묵은 신김치를 활용한 진한 김치 국 느낌이랄까,맛/향/풍미
1000047929,어묵 또한 고래 사가 더 쫄깃하고 맛있어요,맛/향/풍미
1000047929,삼진 어묵은 밀가루 맛이 많이 나더군요,맛/향/풍미
1000047929,결론부터 말씀 드리면 고래 사 승,맛/향/풍미
1000047929,띠용 spc 불매 중인데 여기에 들어 있는 우동 면이 spc 제품이네요,맛/향/풍미
1000047929,맛과 상관없이 재구매는 하지 않겠습니다,가격
1000047929,김치 어묵 전골 밀 키트는 고래 사가 더 나은 것 같아요,맛/향/풍미
1000047929,기대보단 맛이 덜했지만,맛/향/풍미
1000047929,남편은 맛있다고 했어요,맛/향/풍미
1000047929,어묵은 맛이 텁텁하다 느꼈습니다,맛/향/풍미
1000047929,맛있어요,맛/향/풍미
1000047929,투 다리 제품보다 훨씬 나음,맛/향/풍미
1000047929,개인적으로 다른 브랜드 김치 어묵 전골들 보다 삼진 어묵 제품이 제일 맛있네요,맛/향/풍미
1000047929,다들 맛이 비슷비슷하지만 삼진 어묵은 시큼한 맛이 없어서 좋아요,맛/향/풍미
1000047929,조리 시에 김치를 삭힌 듯한 구린내가 올라옵니다,맛/향/풍미
1000047929,국물 맛이 굉장히 아쉽습니다,맛/향/풍미
1000047929,그냥 맹탕에 신맛 짭쪼름한 맛밖에 안 납니다,맛/향/풍미
1000047929,그냥 풍미가 없습니다 깊은 맛이 없어요,맛/향/풍미
1000047929,김치 맛이 강하고,맛/향/풍미
1000047929,어묵은 역시 맛있네요,맛/향/풍미
1000047929,꼬치 2개 더 추가해도 간이 충분해서 넉넉하게 잘 먹었어요,양
1000047929,고사래 어묵 제 입맛엔 가장 좋았어요,맛/향/풍미
1000047929,진하면서도 물리지 않는 시원함도 있고 어묵이 진짜 맛있,맛/향/풍미
1000047929,투다리 시원 깔끔한 게 땡기는 날은 요겁니다,맛/향/풍미
1000047929,뭔가 말간 느낌이에요,맛/향/풍미
1000047929,국물에서 액젓 맛이 좀 더 강했어,맛/향/풍미
