product_id,review,category
5070615,국물은 매워요 그런데 맛있게 매워요,맛/향/풍미
5070615,안 매운 소 곱창 전골도 있으면 정말 좋겠다는 생각이 들었어요,맛/향/풍미
5070615,건더기를 다 건져 먹고 남은 국물에는 우거지를 넣고 또 끓였어요,활용 방법
5070615,매운 맛도 덜해지고 깊은 맛은 그대로 여서 한 봉지로 여러 번 먹었네요,양
5070615,맵지만 재주문할 거예요,활용 방법
5070615,국물 맛은 파는 곱창전골 맛,맛/향/풍미
5070615,양도 푸짐하게 들어가 있고 배추까지 들어가 있어서 매우 만족합니다,양
5070615,가격 착하고,가격
5070615,그냥 이것만으로도 데우기만하면 충분히 먹을 수 있어서 맛에 간편함까지 더하네요,활용 방법
5070615,집에 쑥갓 파 팽이버섯이 있어서 추가해 줬어요,활용 방법
5070615,취향에 따라 떡국 떡이나 우동 사리 라면 사리 추가해 드시면 좋을 듯 합니다,활용 방법
5070615,캠핑 가실 때 아주 좋을 듯 해요,활용 방법
5070615,저흰 3 인 기준 2 팩으로 한 끼 잘 먹었어요,양
5070615,비닐이 나왔어요,포장/배송
5070615,대용량으로 만드는 음식일 텐 테요,양
5070615,더 청결하게 정성 들여 만들어 주시길 바랍니다,맛/향/풍미
5070615,좋아하던 곱창전골 집 맛이 비슷하게 나서 맛있게 잘 먹었어요,맛/향/풍미
5070615,재구매하려고합니다,보관
5070615,2번 정도 먹기 적당한 양인 것 같아요,양
5070615,냄새가 나서 후추 미나리 이런저런 수를 써 봐도 잡내를 잡을 수 없었네요,맛/향/풍미
5070615,저만 아까워서 먹고 나머지는 버림,양
5070615,2개 사서 남편이랑 먹으니까 사 알 짝 부족한 듯 딱 맞게 잘 먹었어요,양
5070615,곱 냄새는 아예 안 나진 않고 살짝 나서 후추 뿌려서 먹었어요,맛/향/풍미
5070615,맛나요,맛/향/풍미
5070615,우거지의 줄기 부분이 엄청 질겨서 삼키기 불안할 정도,맛/향/풍미
5070615,과도하게 질긴 섬유질 섭취가 부담스러워서,양
5070615,국물의 간이나 들어 있는 내장의 양 모두 만족,양
5070615,짜지 않고 조미료 느낌도 거의 안 나고 잡내도 없음,맛/향/풍미
5070615,맛있어요,맛/향/풍미
5070615,맛이나 향이 너무 강하지 않아서 잘 먹었어요,맛/향/풍미
5070615,재구매 의사 있습니다,가격
5070615,약간 냄새가,맛/향/풍미
5070615,곱은 가득한데 씹으니 이상한 쓴맛이 너무 나서,맛/향/풍미
5070615,곱창 씹는 순간 누린내가 너무 났어요,맛/향/풍미
5070615,첫 실패였어요,맛/향/풍미
5070615,곱창에서 조금 아쉬운 냄시가 나지만,맛/향/풍미
5070615,그래도 다시 사 먹을 겁니다 맛있거든요,맛/향/풍미
5070615,상했네요,포장/배송
5070615,곱이 상한 것 같아요,양
5070615,국물까지 시큼해서 바로 버렸어요,맛/향/풍미
5070615,날이 더우면 포장에 더 신경 써 주시길 바랍니다,포장/배송
5070615,진짜 별로임,맛/향/풍미
5070615,냄새도 엄청 나고,맛/향/풍미
5070615,역한 맛 엄청 느껴져요,맛/향/풍미
5070615,도저히 안 될 거 같아서 다 음식물 쓰레기통에 버림,양
5070615,다시는 안 사 먹을 거 같습니다,보관
5070615,세 식구 중 저만 좋아하는 곱창전골,맛/향/풍미
5070615,집에 있는 야채 버섯 등 추가하여 제가 다 먹습니다,활용 방법
5070615,우동 사리 곁들이면 둘이 한 봉지로 한 끼 충분해요,양
5070615,이거 진짜 맛있어요,맛/향/풍미
5070615,곱창 많이 들어 잇어서,양
5070615,가성비 짱이에요,가격
5070615,가끔 곱창전골 너무 먹고 싶은데,활용 방법
5070615,배달해 먹기는 양도 가격도 부담이라서,가격
5070615,그럴 때 주문해 먹기 좋겠어요,활용 방법
5070615,쑥갓이나 깻잎 추가해서 먹으면 더 맛있을 것 같아요,활용 방법
5070615,이렇게 맛있는 지 몰랐어요,맛/향/풍미
5070615,양이 많이 들어 있고,양
5070615,국물 넘 맛나 요,맛/향/풍미
5070615,담에 또 구매할께용,보관
5070615,기름은 뜨는데 곱창 감칠맛은 없고,맛/향/풍미
5070615,기름 국에 떠 있는 곱창 맛 재주문 의사 없습니다,맛/향/풍미
5070615,진짜 맛 앗어요,맛/향/풍미
5070615,유명 소 곱창 전골보다 대박,맛/향/풍미
5070615,강추 강추,맛/향/풍미
5070615,포장 좀 사진처럼 하지 말아 주세요,포장/배송
5070615,걍 박스에 담아 주심 안 될까요,포장/배송
5070615,무슨 마트료시카처럼 벗기고 벗기고 또 벗기고,포장/배송
5070615,제품 비닐 잘릴까 봐 칼질도 잘 못 하겠고,포장/배송
5070615,누린내 땜 거의 다 버렸어요,맛/향/풍미
5070615,맛있네요,맛/향/풍미
5070615,다음엔 2개 시켜서 당면 같은 것도 넣어서 먹어야겠어요,활용 방법
5070615,진짜 잡내 안 나고,맛/향/풍미
5070615,건더기도 푸짐하 거,양
5070615,맛있네요,맛/향/풍미
5070615,뭔가 맛이 변했어요,맛/향/풍미
5070615,양이 많아진 거 같긴한데,양
5070615,가격 대비는 잘 모르겟스니댜,가격
5070615,기대 이상 내용물이 실해서 놀랬어요,양
5070615,간음 약간 슴슴할 수 있는 데,맛/향/풍미
5070615,자극적이지 않아 더 좋아요,맛/향/풍미
5070615,재구매 의사 있어요,가격
5070615,여행 가서 먹으려고 구매했어요,보관
5070615,라면 사리 넣어서 맛있게 먹었습니다,활용 방법
5070615,맛이긴한데 누린내에 예민한 저는 못 먹었어요,맛/향/풍미
5070615,남편도 느껴지긴하는데 괜찮다며 먹긴했구요,맛/향/풍미
5070615,곱은 하나도 없고,양
5070615,우거지 빼고는 들어 있는 내장들 식감은 느끼지도 못하고 흐물흐물 느끼 그 자체네요,맛/향/풍미
5070615,당연히 국물 맛도 깔끔하지 않겠지요,맛/향/풍미
5070615,컬리에서 주문해서 이렇게 큰 실망은 첨이네요,가격
5070615,신중하게 선택해 주세요,가격
5070615,혼자 곱창 전골 먹기 힘든데 밀 키트로 나와서 넘 좋은 것 같습니다,활용 방법
5070615,약간 자극적인 거 같기도한데,맛/향/풍미
5070615,맛있었어요,맛/향/풍미
5070615,이거 진짜 맛잇어요,맛/향/풍미
5070615,남편이 맛있다고 인정,맛/향/풍미
5070615,곱창도 많고,양
5070615,맛있다 하길래,맛/향/풍미
5070615,맛 있게 잘 먹었어요,맛/향/풍미
5070615,내장도 있어서 내장 탕 느낌 나요,맛/향/풍미
5070615,싼데 겁나 맛있네요,가격
5070615,구수한 맛이에요,맛/향/풍미
1000088626,국물이 꽤나 빨갛길래 예상 가능한 맛이라고 생각했는데,맛/향/풍미
1000088626,국물 한 입 먹어 보니 어라 소리가 바로 나옵니다,맛/향/풍미
1000088626,자극적인 맛 전혀 없이 담백한 맛의 국물이었습니다,맛/향/풍미
1000088626,오징어 젓갈과 먹으니 맛있었어요,맛/향/풍미
1000088626,갈빗대는 작은 뼈로 네 개 들어 있는데,양
1000088626,다른 사미헌 강비탕보다 고기가 조금 적은 느낌이지만,양
1000088626,우거지가 참 맛있어 재구매 의사 있습니다,맛/향/풍미
1000088626,너무 맛있어요,맛/향/풍미
1000088626,너무 맛있네요,맛/향/풍미
1000088626,소보로 그래놀라와 또 다른 제품 총 2개가 오지 않음,포장/배송
1000088626,내가 주문하지도 않은 제품이 옴,포장/배송
1000088626,안 받은 제품을 담 날 새벽 배송으로 바로 받길 원함,포장/배송
1000088626,잘 못 온 상품은 담 날 새벽 회수해 간다 함,포장/배송
1000088626,내 상품은 교환 환불도 아니고 자기들이 잘못해서 누락된 상품인데 바로 보내 주지 않고 회수 물건 확인 절차 후 보내 준다 함,포장/배송
1000088626,왜 내가 주문하지도 않은 물건 회수 처리 될 때까지 기다렸다 내 물건을 받아야함,포장/배송
1000088626,왜 지들이 잘못해서 보낸 물건 내 시간 내서 내가 다시 박스 포장 왜 해야함,포장/배송
1000088626,다른 데보다 조금 더 비싸도 새벽 배송으로 빨리 받을 수 있으니 주문하는 건데,가격
1000088626,3일 만에 받을 거면 컬리에서 왜 시킴,가격
1000088626,자기들이 잘못해서 발생된 불편함을 왜 고객이 감수해야 됨,포장/배송
1000088626,갈비탕에서 벌레가 나왔습니다,포장/배송
1000088626,상품 관리를 어떻게 하는 걸까요,포장/배송
1000088626,정말 믿을 만한 곳이 없네요,포장/배송
1000088626,늘 구비해 두고 먹고 있어요,보관
1000088626,이거는 도대체 무슨 맛인지 모르겠네요,맛/향/풍미
1000088626,간이 세지 않고 담백한 확실한 고깃국 물맛이라 좋아했는데,맛/향/풍미
1000088626,갈비는 아주 아주 작은 거 세 개에 갈비탕 맛은 없고,양
1000088626,저 많은 빨간 기름이 고추기름인 건지,맛/향/풍미
1000088626,안 매운 고추만을 넣어 삶은 물을 마시는 느낌,맛/향/풍미
1000088626,너무 기대를 한 탓인지는 몰라도 실망이 큽니다,맛/향/풍미
1000088626,재구매는 당연히 없고 남은하나 처리가 걱정 입니다,보관
1000088626,사미헌 갈비탕을 너무 맛있게 잘 먹었어서,맛/향/풍미
1000088626,오리지널 버전은 조금 짠 대신에 제가 무나 파를 추가해서 간 조절을 했어요,맛/향/풍미
1000088626,고기가 뼈에서 그냥 뚝 떨어질 정도로 부드러워서,맛/향/풍미
1000088626,우거지 갈비탕은 간은 슴슴하고 우거지가 너무 부드러워 넘김이 좋은 대신에 고기가 너무 질겨요,맛/향/풍미
1000088626,이렇게 잘 씹히지 않는 고기는 정말 오랜만이었어요,맛/향/풍미
1000088626,이건 안 될 것 같아요,양
1000088626,고기 부분은 한 입 정도 먹고는 우거지만 다 건져 먹었는데 이 부분이 너무 아쉽네요,양
1000088626,하나는 고기랑 우거지 비율이 좋았는데,맛/향/풍미
1000088626,하나는 우거지만 가득,양
1000088626,고기는 맛 있는데,맛/향/풍미
1000088626,우거지가 깨끗하지 못하고 거뭇거뭇한 게 들어 있어서 별로 안 좋았구요,맛/향/풍미
1000088626,국물에 들깨 가루가 들어 있어 추어탕 먹는 기분이었습니다,맛/향/풍미
1000088626,저는 그냥 갈비탕이 낫네요,맛/향/풍미
1000088626,재구매는 노노,가격
1000088626,고춧가루 등 양념이 베이스라,맛/향/풍미
1000088626,우거지 갈비탕 고기 노린 데 심하게 납니다,맛/향/풍미
1000088626,먹다가 버렸어요,양
1000088626,컬리 직원들 제발 드셔 보시고 물건 파세요,활용 방법
1000088626,갈비가 저렇게 세 개 들어가 있는 게 맞는 거겠죠,양
1000088626,맛도 밍밍해요,맛/향/풍미
1000088626,긴 머리카락이 나왔습니다,포장/배송
1000088626,위생 관리 도대체 어떻게하는 제품인가요,포장/배송
1000088626,밥 먹다 비위 상해서 못 먹겠어요,포장/배송
1000088626,컬리에서 이런 제품을 팔다니 황당해서 말이 안 나오네요,포장/배송
1000088626,싱겁고 고기가 생각보다 없었어요,맛/향/풍미
1000088626,고기 양이 많이 없네요,양
1000088626,우거지 갈비탕은 첨시켜 보내요,양
1000088626,맛이 괜찮네요,맛/향/풍미
1000088626,우거지도 많고 국물도 여유 있고,양
1000088626,갈비대가 한 팩당 4개가 들어 있는데,양
1000088626,들깨 가루 한 숟가락씩 더 넣어 먹음 더 맛나더라구요,활용 방법
1000088626,고기는 조금 아쉬웠어요,양
1000088626,많이 질기지 않아서 좋았어요,맛/향/풍미
1000088626,다음 쎄일 때는 넉넉히 구비해 놓고 먹어야겠어요,보관
1000088626,맛은 사실 갈비탕보단 감자탕 같아요,맛/향/풍미
1000088626,너무 맛있어서 남편이랑 엄 지척을 외치고 주변에도 추천했는데,맛/향/풍미
1000088626,양도 줄고,양
1000088626,맛도 너무 밍밍해져서,맛/향/풍미
1000088626,제가 먹던 게 맞나 싶었어요,맛/향/풍미
1000088626,이런 맛이라면 다시는 안 시켜 먹고 싶네요,맛/향/풍미
1000088626,넘 느끼하고,맛/향/풍미
1000088626,고기에 기름인지 뭔지 물컹한 것만 잔뜩,맛/향/풍미
1000088626,바쁜 아침에 먹기 딱 좋아요,활용 방법
1000088626,전날 냉장고에 미리 해동하고,보관
1000088626,간 편하면서 든든한 식사됩니다,활용 방법
1000088626,1 인분보단 2 인분도 가능해요,양
1000088626,후기가 너무 좋아 기대해서 그런지 전 그냥 쏘쏘했어요,맛/향/풍미
1000088626,우거지가 생각보다 부드럽지는 않았고,맛/향/풍미
1000088626,조미료 맛이 확 나진 않아 괜찮았어요,맛/향/풍미
1000088626,전 그냥 일반 갈비탕이 좋아요,맛/향/풍미
1000088626,우거지 갈비탕 맛있어요,맛/향/풍미
1000088626,살짝 매콤해서 더 맛있어요,맛/향/풍미
1000088626,무척 실망스럽네요,양
1000088626,사진처럼 중간 크기 갈비 딱 두 대고,양
1000088626,그나마 질겨서,맛/향/풍미
1000088626,우거지 국은 맛있어요,맛/향/풍미
1000088626,다시는 주문 안 할 듯합니다,가격
1000088626,기름 뜬 거 보세요,맛/향/풍미
1000088626,느끼해요,맛/향/풍미
1000088626,깔끔함이 없음,맛/향/풍미
1000088626,재구매는 안 할래요,가격
1000088626,고기가 좀 질기게 느껴졌어요,맛/향/풍미
1000088626,기름이 많고 좀 싱거워요,맛/향/풍미
1000088626,어딘가 모르게 2 부 족함을 느껴요,맛/향/풍미
1000088626,맛있기는한데 제 입맛에는 좀 느끼하네요,맛/향/풍미
1000088626,생각보다 기름져요,맛/향/풍미
1000088626,고기 너무 작은 거 3개 들어가 있어요,양
1000088626,맛도 밍밍하고,맛/향/풍미
1000088626,다신 안 사 먹을 제품이에요,가격
1000088626,쪼매 난 고기 3 조각 들어 있었다고 하네요,양
1000088626,우거지 맛이 너무 이상해요,맛/향/풍미
1000088626,풋내 많이 나고 갈비탕이랑 따로 놀아요,맛/향/풍미
1000088626,두 번은 못 시키겠네요,가격
1000088626,양이 많아요,양
1000088626,맛있어요,맛/향/풍미
1000088626,우거지 양도 많고요,양
1000088626,근데 고기는 좀 질겨요,맛/향/풍미
1000088626,특히 뼈랑 붙어 있는 고기는 잘 뜯기지 않네요,양
1000088626,파는 게 이런 맛이 나다나요,맛/향/풍미
1000088626,왠 만한 배달보다 훨 맛있습니다,맛/향/풍미
1000088626,국물 맛는 괜찮는데,맛/향/풍미
1000088626,고기는 질겨서 별루예요,맛/향/풍미
1000088626,우거지 갈비탕도 정말 맛있네요,맛/향/풍미
1000088626,맛 잇어서 재구매햇어요,맛/향/풍미
1000088626,고기가 맛 잇고 양도 많은 편이라 믿고 재주문햇어요,양
1000088626,근데 2 팩이나 오픈햇고,포장/배송
1000088626,정상적인 갈비 고기가 작은 거 2개 어이없음,양
1000088626,간도 완전 싱겁고 풀만 먹은 듯,맛/향/풍미
1000088626,너무 맛없게 먹어서 기분이 안 좋으네여,맛/향/풍미
1000088626,짜지 않고 너무 구수하고 맛있어요,맛/향/풍미
1000088626,자극적인 맛에 길들여져 있어서 그런지 심심한듯,맛/향/풍미
1000088626,들깨 가루 안 좋아해서 재구매는 안 할 거 같아요,맛/향/풍미
1000088626,들깨가 들어가서 고소해요,맛/향/풍미
1000088626,자극적이지 않으면서 맛있어요,맛/향/풍미
1000088626,고기도 부드럽고 넘 맛나서 재구매합니다,맛/향/풍미
1000088626,냉동실 쟁여템,보관
1000088626,양도 넉넉하고,양
1000088626,맛도 좋아요,맛/향/풍미
1000088626,맛나서 다시 샀어요,맛/향/풍미
1000088626,우거지도 많고,양
1000088626,고기도 부들부들 좋았어요,맛/향/풍미
1000088626,맛나요 시원하고 맵기도 딱 좋아요,맛/향/풍미
1000088626,우거지와 국물은 맛있고,맛/향/풍미
1000088626,갈비는 복불복이나 가격 대비 좋아요,가격
1000088626,맛은 사미헌이니 믿어요,맛/향/풍미
1000088626,여러 번 재구매 인대,보관
1000088626,아직 맛도 못 봤어요,맛/향/풍미
1000088626,좋아합디다,맛/향/풍미
1000088626,맛있어서 재구매했어요,맛/향/풍미
5049686,찬 물에 넣고 해동시키니까 금방 해동 되서 끊여 먹기 간편했어요,활용 방법
5049686,또 주문해도 될 맛입니다,맛/향/풍미
5049686,존 맛임,맛/향/풍미
5049686,비싸요,가격
5049686,세일할 때 먹어야 됨,가격
5049686,부속 고기가 넘 많이 들어 있더라구요,양
5049686,배신감이 드네요,맛/향/풍미
5049686,다른 반찬이나 국에 비해 향미 증진제 같은 화학 조미료가 포함이 안 되어 있어 애용했습니다,맛/향/풍미
5049686,믿고 먹는 식품의 성분 표기 방법에 대해 다분히 의도적으로 보이는 표기로 인해 오히려 반감이 들어 다시는 사 먹고 싶지 않아지네요,가격
5049686,재료도 국산 착한 재료에 넉넉한 양,양
5049686,국물도 많아 가정용 국그릇에 3 그릇 정도 나와요,양
5049686,간은 따로 하지 않아도 될 만큼 간 간해요,맛/향/풍미
5049686,부추 마늘 파 들깨 가루 등 기호에 맞게 추가해 주세요,활용 방법
5049686,부추 한 단 깨끗히 씻고 탈탈 털어 물기 제거하고,활용 방법
5049686,썰어서 냉동해 두었다 순대국 팔팔 끓을 때 넣어도 맛있어요,활용 방법
5049686,양이 많아 든든해요,양
5049686,순댓국 맛있어서 자주 사 먹습니다,맛/향/풍미
5049686,순대가 따로 들어 있어요,양
5049686,이가 순대가 젤 맛있데요,맛/향/풍미
5049686,고기는 좀 냄새 나는 게 있어요,맛/향/풍미
5049686,그건 빼고 먹어요,활용 방법
5049686,개선 좀 해 줬으면 좋겠어요,활용 방법
5049686,국내산 사골과 비법 육수로 만든 하얀 국물에,맛/향/풍미
5049686,순대 돼지 머리 고기 염통 오소리 감투 푸짐하게 들어 있어요,양
5049686,갈수록 내용물이 부실해져요,양
5049686,가족들 중에 특히 남자들이 더 맛있어 하고 좋아해서,맛/향/풍미
5049686,고기도 많이 들어 있고,양
5049686,양이 많아요,양
5049686,얼큰한 맛은 밍밍하고 기름진 맛인데,맛/향/풍미
5049686,이거는 맛있어요,맛/향/풍미
5049686,맛있어요,맛/향/풍미
5049686,추가로 들깨 가루 넣어 먹으면 더 맛있네요,활용 방법
5049686,맛있다고 합니다,맛/향/풍미
5049686,세일 하니 더 좋으네요,가격
5049686,흰 국물이 얼큰 보다 맛있어요,맛/향/풍미
5049686,순대도 맛나고,맛/향/풍미
5049686,국물도 맛나네요,맛/향/풍미
5049686,마늘이랑 대파 추가해서 끓였는데,활용 방법
5049686,냄새도 안 나고,맛/향/풍미
5049686,양도 2 인이 먹기에 적당하고 좋네요,양
5049686,재구매해야겠어요,가격
5049686,건더기가 푸짐하네요,양
5049686,두 그릇으로 나눠 먹었어요,양
5049686,순대국 너무 너무 좋아요,맛/향/풍미
5049686,배송 빠름,포장/배송
5049686,특히 들어 있는 순대가 아주 맛나네요,맛/향/풍미
5049686,정말 맛있네요,맛/향/풍미
5049686,건더기도 싱하고 고기도 쫄깃하게 맛있고,맛/향/풍미
5049686,부속도 많이 들어 있어요,양
5049686,국물도 잡내 하나도 안 나도 구수하고요,맛/향/풍미
5049686,강추 합니다,맛/향/풍미
5049686,맛있게 먹다가 찍었네요,맛/향/풍미
5049686,건더기도 넉넉하고,양
5049686,순대도 맛있어요,맛/향/풍미
5049686,재구매 예정입니다,보관
5049686,이 순대국이 제일 괜찮아 사요,맛/향/풍미
5049686,아이들도 잘 먹어요,양
5049686,가끔 냄새가 날 때도 있지만 그래도 먹을 만합니다,맛/향/풍미
5049686,오 아주 맛나요,맛/향/풍미
5049686,유명한 데 가서 먹는 맛이에요,맛/향/풍미
5049686,맛있어서 3개나 쟁였어요,보관
5049686,올겨울엔 요걸로 밥둔든히 ㅎ,활용 방법
5049686,순대국 두 봉에 셋이 배부르게 먹엇어요,양
5049686,국물이 넉넉해서 좋아요,양
5049686,진짜 많이 시켜 먹고 있어요,양
5049686,냄새 안 나고 깔끔하고,맛/향/풍미
5049686,양도 많아서 좋아요,양
5049686,이번에는 냄새가 좀 나요,맛/향/풍미
5049686,세일해서 사 봄,가격
5049686,약간 짜긴한데,맛/향/풍미
5049686,국물 맛 있어요,맛/향/풍미
5049686,고기 냄새도 안 나고,맛/향/풍미
5049686,건더기도 제법 있어요,양
5049686,비상템으로 괜찮네요,보관
5049686,컬리 순대국 중에서 저는 이게 제일 맛나요,맛/향/풍미
5049686,간이 잘 되어 있어서 파만 살짝 올려 먹었는데 깔끔하니 맛있습니다,맛/향/풍미
5049686,소금 간 살짝 하고 파 송송 청양고추 넣어서 먹었는데 만족스럽습니다,맛/향/풍미
5049686,직접 가서 먹는 것만큼 맛있어요,맛/향/풍미
5049686,새우젓으로 간은 조금 더 했구요,맛/향/풍미
5049686,건더기 양과 국물 양이 많아요,양
5049686,두 명이서 먹을 수 있는 양입니다,양
5049686,기름진 부위 아닌 고기도 많고 순대도 맛있어요,맛/향/풍미
5049686,간도 많이 안 짜서 그냥 먹어도 괜찮았어요,맛/향/풍미
5049686,밥을 말을 땐 샤우젓 청양 초 정도 더 넣으니 좋더라구요,활용 방법
5049686,비상용으로 냉동실에 두면 아주 마음이 편합니다,보관
5049686,국물 진하고 건더기도 푸짐해서,맛/향/풍미
5049686,내용물이 푸짐하고,양
5049686,양도 많아 넉넉히 잘 먹음,양
5049686,유통기한  24년 6월 24일,보관
5049686,평이 좋아서 기대됩니다,맛/향/풍미
5049686,패키지가 훨씬 큰 걸 보면 양도 많을 것 같아요,양
5049686,함께 구매한 부추와 들깨도 넣어서 먹어 봐야겠어요,활용 방법
5049686,식당에서 사 먹는 맛이랑 같아요,맛/향/풍미
5049686,양도 넉넉하고,양
5049686,맛있어요,맛/향/풍미
5049686,국밥 좋아하는 남편이 엄지 척 하네요,맛/향/풍미
5049686,양이 넉넉하니 좋아요,양
5049686,전통 순대는 9개 따로 포장되어 있고,양
5049686,부속 고기도 많이 있어요,양
5049686,기름진 편이어서 기름진 거 싫어하시는 분은 한 번 푹 끓인 후 식혀서 기름기 걷어 내고 먹는 것도 좋은 방법인 거 같아요,활용 방법
5049686,간은 새우젓이나 천일염으로 맞춰 주시고,활용 방법
5049686,후추 들깨 가루 2 스푼 다진 마늘 1 스푼 파 한 줌 넣고 팔팔 끓여서 먹었습니다,활용 방법
5049686,국물은 합격 입니다,맛/향/풍미
5049686,맛있는 데 안에 내용물들이 질겨요,맛/향/풍미
5049686,진짜 순대만 먹을 만한 정도이고 나머지는 다 질겅질겅거려서 버렸어요,양
5049686,건더기가 많은데,양
5049686,국물 짜서 국물은 버림,맛/향/풍미
5049304,고기 질겼고,맛/향/풍미
5049304,국물도 조금 냄새 나고 그랬어요,맛/향/풍미
5049304,신선보다 이 게 더 맛 잇어요,맛/향/풍미
5049304,깔끔한 맛이에요,맛/향/풍미
5049304,짜거나하지 않아서 아이들도 먹기 좋을 것 같아요,맛/향/풍미
5049304,싱거운 맛이 나,맛/향/풍미
5049304,건강한 맛을 추구하시면 추천 드려요,맛/향/풍미
5049304,저는 밥 말아 먹었습니다,활용 방법
5049304,곰탕보다는 이게 더 맛있어요,맛/향/풍미
5049304,배송이 너무 빨리 와요,포장/배송
5049304,여름인데 새벽 배송 1시에 오면 밤새 다 녹아서,포장/배송
5049304,아침에 다녹아았어요,포장/배송
5049304,곰탕이 맛있어 주문해 봤는데,맛/향/풍미
5049304,맛 있어서 재구매,맛/향/풍미
5049304,맛있어요,맛/향/풍미
5049304,쟁여 두면 참 든든합니다,보관
5049304,고기 양도 많고 얇지 않고,양
5049304,국물도 좋아요,맛/향/풍미
5049304,재구매 의사 백 프로,활용 방법
5049304,어머니가 가장 좋아하셔서 자주 구매하고 있어요,활용 방법
5049304,고기도 넉넉해요,양
5049304,비상용으로 쟁여 놔요,보관
5049304,아이들이 좋아해요,맛/향/풍미
5049304,한 끼 식사로 딱이에요,활용 방법
5049304,고기가 많아요,양
5049304,가격도 좋고,가격
5049304,냄새 안 나고,맛/향/풍미
5049304,맛도 좋아서 매번 주문하는 제품입니다,맛/향/풍미
5049304,간이 좀 되어 있다고 느껴졌어요,맛/향/풍미
5049304,리뷰처럼 고소하고 맛있더라고요,맛/향/풍미
5049304,고기도 적지 않았고요,양
5049304,소면 삶아서 같이 주니 잘 먹더라고요,활용 방법
5049304,고기도 넉넉하게 들어 있고,양
5049304,국물도 맛있어요,맛/향/풍미
5049304,가성비가 가장 좋은 거 같아요,가격
5049304,걸쭉하지 않고,맛/향/풍미
5049304,맛 잇어요,맛/향/풍미
5049304,양도 푸짐해 보이고,양
5049304,구매 평이 좋아서 맛볼려고 샀네요,맛/향/풍미
5049304,자극적이지 않아서 좋고,맛/향/풍미
