product_id,product_type,category,summary
5025668,아욱된장국,맛/향/풍미,"이 국은 맛이 좋고 양도 풍부하며, 구수한 맛이 깊은 편입니다. 맛이 좋아서 자주 구매하는 제품입니다."
5025668,아욱된장국,보관,이 제품은 냉장 보관이 편리한 장점이 있습니다.
5025668,아욱된장국,양,양이 적절하게 유지되어야 합니다.
5025668,아욱된장국,포장/배송,된장국이 터져서 박스와 다른 상품에 물이 흘러내려서 문제가 발생했습니다.
5037568,진한 육개장,맛/향/풍미,"피코크의 육개장은 맛이 진하고 조미료의 맛이 적은 편입니다. 특히 국물이 진하고 평범한 맛이 나며, 맛은 그냥 좋습니다."
5037568,진한 육개장,보관,"해동이 필요 없기 때문에 자주 구매하고, 세일 때 쟁여두면 좋습니다. 냉동실에 보관하면 식감이 좋지만, 냉동한 채소들은 냉장으로 보관하는 것이 좋습니다."
5037568,진한 육개장,양,이 제품은 양이 충분하여 두 끼 먹을 수 있고 건더기가 풍부하여 맛이 좋습니다. 건더기와 국물이 풍부한 이 제품은 한 그릇으로도 알차게 먹을 수 있습니다.
5049304,설렁탕,가격,이 제품은 가격이 저렴하고 가성비가 좋습니다.
5049304,설렁탕,맛/향/풍미,고기 질기고 국물은 냄새나지만 신선보다 맛이 더 좋다고 느껴집니다. 깔끔하고 짠 맛이 없는 곰탕보다 더 맛있는 제품입니다.
5049304,설렁탕,보관,"냉동실에 보관하면 편리하고, 급할 때나 식욕이 없을 때 간단하게 먹을 수 있습니다."
5049304,설렁탕,양,고기가 넉넉하게 들어 있는 음식입니다.
5049304,설렁탕,포장/배송,"새벽 배송은 너무 빠르다는 느낌이 들었습니다. 하지만, 여름에 새벽 배송을 받았을 때는 밤새 물이 녹아버려서 아침에 모두 녹아버렸습니다."
5044657,온달 육개장,가격,품질과 맛은 평범했지만 비싼 편에 속했습니다.
5044657,온달 육개장,맛/향/풍미,"맛은 무난했고, 국물이 맑고 담백하여 좋았습니다. 담백하고 개운하며 따뜻하게 먹을 수 있는 맛을 즐길 수 있었습니다."
5044657,온달 육개장,보관,오랫동안 즐겨 먹던 제품을 저렴한 가격에 구입하여 보관하기로 결정했습니다.
5044657,온달 육개장,양,양이 적당하고 재료가 풍부하지만 건더기와 고기가 부족한 편입니다.
5031054,토종 순대국,가격,이 음식은 가격에 비해 맛과 양이 만족스러웠습니다. 가격이 저렴한 편입니다.
5031054,토종 순대국,맛/향/풍미,"이 순대국은 맛이 좋고 냄새가 나지 않으며, 뻣뻣하지 않은 순대 고기가 들어간 깔끔하고 맛있는 국물로 이루어져 있습니다."
5031054,토종 순대국,보관,이 제품은 냉동 후 다시 사용할 수 있습니다.
5031054,토종 순대국,양,"이 음식은 양이 풍부하고 맛이 좋으며, 머릿고기와 건더기가 푸짐하고 내용물이 많습니다. 또한 내장과 순대, 고기가 함께 들어있어 맛과 질이 좋은 음식입니다."
5031054,토종 순대국,포장/배송,오전 4시에 도착한 물품의 아이스팩이 물이 돼서 식품이 녹아 있었습니다. 배송 시간을 알려주시면 감사하겠습니다.
1000431398,우차돌짬뽕탕,맛/향/풍미,"차돌이 들어간 국물은 진하고 맛있으며, 청경채를 추가하면 더욱 맛있답니다."
1000431398,우차돌짬뽕탕,양,양은 적절하고 고기는 풍부합니다.
1000341457,맑은 순대국,가격,이 제품은 칼로리가 낮고 가격이 저렴합니다.
1000341457,맑은 순대국,맛/향/풍미,"순대 국물이 깔끔하고 맛있으며, 담백한 맛과 적당한 향이 특징입니다."
1000341457,맑은 순대국,보관,"이 제품은 가성비가 뛰어나고, 냉동 후에도 유지하기 좋습니다."
1000341457,맑은 순대국,양,1인분은 양이 적지만 2인분으로 충분히 먹을 수 있는 양입니다.
1000341457,맑은 순대국,포장/배송,"제품은 깔끔하게 패킹되어 배송이 빠르며, 급할 때 주문하기 적합합니다. 제품은 주문 후 다음날 도착하여 냉동 상태로 잘 도착했습니다."
5042765,차돌 된장찌개,맛/향/풍미,이 제품은 맛있는 된장찌개로 재료가 많고 간이 쎈 편입니다. 청국장 맛이 진하고 개운한 맛이 칼칼해져서 봄철 입맛 없을 때 잘 맞습니다.
5042765,차돌 된장찌개,보관,차돌 된장 찌게는 냉장고에 전날 옮겨 냉장해 주거나 간편한 방법으로 가끔 구매하여 냉동실에 보관하는 것이 좋습니다.
5042765,차돌 된장찌개,양,양은 풍부합니다.
5030967,김치콩나물국,가격,품질 좋은 김치 콩나물국을 합리적인 가격에 즐길 수 있어 가성비가 좋습니다.
5030967,김치콩나물국,맛/향/풍미,"김치 콩나물국은 시원하고 맛있는 국물로, 매콤한 맛과 아삭한 식감이 잘 어우려 입맛을 돋우며 신선함이 인상적입니다."
5030967,김치콩나물국,보관,한 팩을 사 두면 언제든지 간편하게 끓여 먹을 수 있어요. 비상용으로 쟁여 놓기 좋습니다.
5030967,김치콩나물국,양,"푸짐한 양과 넉넉한 김치 콩나물이 있는 반면, 콩나물이 조금 적고 내용물이 부실하다는 단점이 있습니다. 양이 풍부하여 한 끼로 충분하고 두 끼도 먹을 수 있습니다."
5030967,김치콩나물국,포장/배송,포장 상태가 깨끗하고 위생적이기 때문에 신선한 상태를 유지할 수 있습니다.
5095132,고래사 매콤 어묵탕,맛/향/풍미,"어묵탕은 칼칼한 국물과 얼큰한 맛, 쫄깃한 어묵이 특징입니다. 어묵과 무가 잘 어울려서 맛있으며, 매콤하지 않으며 물을 적게 넣어도 맵지 않습니다."
5095132,고래사 매콤 어묵탕,보관,"이 제품은 큰 포장을 가지고 있으므로, 보관 시 박스를 제거하고 냉동실에 보관하는 것이 좋습니다."
5095132,고래사 매콤 어묵탕,양,어묵의 양이 적지만 다양한 종류가 들어있어 만족스럽습니다.
