product_id,product_type,category,summary
5123141,옛날 한우 육개장 500g,포장/배송,"냉동 제품을 식당에서 먹는 맛은 아닐 수 있지만, 일부 제품이 녹아서 왔습니다. 다행히도 제품이 터진 건 아니지만, 다른 제품도 모두 녹아 있어 먹어야 하는 상황이었습니다."
1000237311,나주식 한우 곰탕,맛/향/풍미,곰탕이 구수하고 깔끔하여 좋아요. 맛은 깔끔하고 깊은 감칠맛이 느껴지는 맛이 있습니다.
1000237311,나주식 한우 곰탕,보관,"곰탕을 한 개만 사서 맛본 후에 특가 때 6개를 냉동실에 보관했습니다. 냉동실에 공간이 없어서 더 사지 못했지만, 다음 번에도 곰탕을 미리 쟁여야겠다고 생각했습니다."
1000237311,나주식 한우 곰탕,양,양은 두 명이서 먹기에는 조금 적은 편입니다. 고기는 한우로 56점이며 토실토실하고 보드랍지만 조금 더 들어가면 좋습니다.
1000237311,나주식 한우 곰탕,포장/배송,"포장은 꼼꼼했지만, 배송 과정에서 문제가 발생했습니다. 배송이 늦어지면 냉동 상품이 녹을 수 있어 배송 확인을 반복해야 하는 불편함이 있었습니다."
5057668,경복궁 BLACK 도가니탕&고기곰탕 (4개입),가격,"컬리에서 구매할 때 할인 및 쿠폰을 사용하면 저렴하게 제품을 구매할 수 있다. 낱개 가격 11,000원보다 선물 세트 4개를 구매할 때 5,000원 더 저렴한 가격으로 구매할 수 있었다."
5057668,경복궁 BLACK 도가니탕&고기곰탕 (4개입),맛/향/풍미,"도가니탕은 곰탕보다 실속 있고 개운한 맛이 나며, 국물은 우유빛깔로 진하고 맛있지만 곰탕은 분유 맛이 나는 느낌과 하얀 국물이 이상합니다."
5057668,경복궁 BLACK 도가니탕&고기곰탕 (4개입),보관,"이 제품은 냉동 후에도 맛이 유지되도록 냉동실에 보관하는 것이 좋으며, 고객은 고기 곰탕을 냉동 후에도 든든한 맛을 즐길 수 있습니다.ただし, 유통 기한이 짧은 고기 곰탕을 주의해야 합니다."
5057668,경복궁 BLACK 도가니탕&고기곰탕 (4개입),양,도가니는 양이 많지만 국물이 부족하고 고기는 두 개 정도 들어있으며 구성은 좋지만 얇은 고기 부족한 점이 있습니다.
5057668,경복궁 BLACK 도가니탕&고기곰탕 (4개입),포장/배송,"제품이 다른 제품으로 오배송되어 반품과 환불이 어려웠으며, 포장 문제로 도넛이 젖어버렸습니다."
5029746,착한들 한우 진한사골곰탕,가격,맛있는 한 끼를 저렴한 가격에 즐길 수 있어서 좋았습니다. 재구매하고 싶은 제품입니다.
5029746,착한들 한우 진한사골곰탕,맛/향/풍미,진한 국물이 맛있다는 평이 나옵니다.
5029746,착한들 한우 진한사골곰탕,보관,이 제품은 냉장 보관이 가능하여 장기간 보관이 가능합니다.
5029746,착한들 한우 진한사골곰탕,양,양이 풍부하지만 건더기가 부족하여 국물이 변색되어 만족스럽지 않습니다.
5029746,착한들 한우 진한사골곰탕,포장/배송,냉장 냉동식품을 시키기 불편한 이유는 아이스팩이 구멍이 나서 박스가 젖은 채로 배송된 문제 때문입니다.
5049679,김치 우리콩 비지찌개,가격,내용물과 비해 비싼 가격입니다.
5049679,김치 우리콩 비지찌개,맛/향/풍미,"이 비지찌개는 맛이 괜찮은데, 살짝 매콤한 맛이 있는 비지찌개입니다. 하지만 김치의 시큼함이 강해 전체적으로 맛이 떨어집니다."
5049679,김치 우리콩 비지찌개,보관,"이 제품은 오래 보관할 수 있는 냉동 제품으로, 재구매를 여러 번 하게 되었습니다. 제품을 바로 개봉했을 때 잘 얼려져 있어 보관 방법의 장점이 있습니다."
5049679,김치 우리콩 비지찌개,양,비지찌개는 국물이 많고 비지가 적습니다. 비지가 적어 묽고 뻑뻑한 맛이 나지만 조금 더 비지가 많아졌으면 좋겠습니다.
1000146369,빨간꼬치어묵&부산물떡,가격,"이 제품은 재구매를 고려하지 않는다고 생각되며, 다른 브랜드가 더 좋다고 느끼는 제품입니다. 하지만 가성비가 좋고 소스가 포함된다는 장점이 있습니다."
1000146369,빨간꼬치어묵&부산물떡,맛/향/풍미,이 상품은 매운맛이 강하고 중독성이 있어요. 먹을 수 없을 정도로 달고 매력적입니다.
1000146369,빨간꼬치어묵&부산물떡,보관,"이 제품은 자주 구매하는 인기 제품으로, 재구매 고객이 많습니다. 재구매 시 적당히 해동시키면 사용하기 편리합니다."
1000146369,빨간꼬치어묵&부산물떡,양,어묵만 먹고 국물은 버렸습니다.
1000146369,빨간꼬치어묵&부산물떡,포장/배송,"냉동 어묵이 녹아 있었고, 드라이아이스가 한 개만 들어있었습니다. 배송은 빠르게 진행되었습니다."
5049762,꽃게 해물탕,가격,"이 제품은 비싼 가격과 국물 비용이 단점이지만, 가격에 비해 만족스러운 품질을 제공합니다."
5049762,꽃게 해물탕,맛/향/풍미,"이 리뷰를 요약하면 다음과 같이 말할 수 있습니다.

국물은 맛있지만 해물이 부실했다고 하셨습니다."
5049762,꽃게 해물탕,보관,냉동 제품은 생물의 품질을 유지하기 어렵기 때문에 생물은 따라올 수 없다는 것을 알았습니다.
5049762,꽃게 해물탕,양,"해물이 부실하고 홍합은 알이 거의 씨앗 수준인 반면, 국내산 흰 다리 냉동 새우는 풍성했지만 냉동 꽃게는 살이 실하지 않습니다."
5094273,만두전골,맛/향/풍미,"이 제품은 맛있고 담백합니다. 국물과 만두, 채소 등이 신선하고 맛있으며, 가족과 함께 즐길 수 있습니다."
5094273,만두전골,양,양이 적지만 야채가 풍부하게 담긴 음식입니다.
5094273,만두전골,포장/배송,"포장 상태에 문제가 있었고 뚜껑이 깨져서 내용물을 꺼내야했습니다. 재활용하기 좋게 스티커도 잘 떼어졌고, 플라스틱도 재활용할 수 있었습니다."
5071449,갈빗살육개장 (1인분),가격,"이 제품은 세일 때 저렴하게 구입하면 좋은 선택이며, 만족도가 매우 높습니다."
5071449,갈빗살육개장 (1인분),맛/향/풍미,"육개장은 국물이 맛있고 건더기도 실렸지만, 고기는 뭉퉁하고 비계가 많았습니다. 맛은 식당에서 먹던 것과 비슷했지만, 약간 다르며 덜 자극적이었습니다."
5071449,갈빗살육개장 (1인분),보관,"냉동된 요리된 완제품은 한두 달이면 다 먹을 수 있으므로 재구매가 필요하지 않으며, 냉동으로 보관하면 비상식량처럼 냉동실에 보관할 수 있습니다."
5071449,갈빗살육개장 (1인분),양,"육개장을 데운다면 고기가 많지만, 한 끼로만 먹는다면 고기가 거의 없다는 점이 아쉬울 수 있습니다. 하지만 건더기가 많고 양이 넉넉한 편이며, 고추기름도 넉넉하고 퀄리티도 좋으며 갈 빗살이 큼직하게 들어 있습니다."
5071449,갈빗살육개장 (1인분),포장/배송,"제품은 2023년 10월에 제조되었으며 유통 기한은 1년입니다. 그러나 1년 이상 냉동 보관에 대한 걱정은 있지만, 10개월 지난 제품은 문제가 없을 것으로 보입니다."
5112148,남원골 추어탕,가격,"이 제품은 가격 대비 맛이 좋지만, 밖에서 먹는다면 두 배 가격을 지불해야 하는 약점이 있습니다."
5112148,남원골 추어탕,맛/향/풍미,추어탕 전문점의 추어탕은 맛있지만 진하지 않으며 약간 비리고 쓴맛이 나서 별로였습니다. 맛은 칼칼하고 매력적이며 어른 입맛에 적합한 대체 음식으로 먹을 만한 맛입니다.
5112148,남원골 추어탕,보관,해동은 미지근한 물에 금새 녹는다는 점을 고려해 보관 방법에 대해 알려드리겠습니다. 냉장고에 보관하는 것이 좋습니다.
5112148,남원골 추어탕,양,"이 제품은 550g의 중량에 건강한 식재료 205kcal가 들어있으며, 양이 충분합니다."
5112148,남원골 추어탕,포장/배송,욱이네 남원 골 추어탕은 미꾸라지와 국산 통 들깨로 구성된 제품으로 냉동 상태로 배송됩니다.
5097093,우렁이 옛날 된장찌개,맛/향/풍미,"우렁이 된장찌개는 크고 쫄깃한 우렁이로 맛있고 건강한 맛이 나며, 매콤한 된장 맛이 시래기 우렁과 잘 어울립니다. 맛은 얼큰하고 우렁이 맛이 좋으며, 우거지 맛과 쫄깃한 우렁이 맛이 잘 어울려서 즐거운 식사로 즐길 수 있습니다."
5097093,우렁이 옛날 된장찌개,보관,"이 제품은 자주 구매하여 재구매하는 인기 메뉴로, 맛있는 맛을 유지하기 위해 냉동 후 재조리하면 좋습니다."
5097093,우렁이 옛날 된장찌개,양,이 음식은 국물이 많고 건더기가 부실해 푸짐하게 먹을 수 있습니다. 특히 우렁이와 두부를 함께 먹으면 더욱 푸짐해집니다.
1000166176,갈비탕,가격,"가격은 일반 식당과 비교했을 때 큰 차이가 없으며, 10000원 정도의 가격은 맛과 양을 고려할 때 적절한 수준입니다."
1000166176,갈비탕,맛/향/풍미,솔가 원 갈비탕은 맛이 좋고 깔끔하다는 평을 듣습니다.
1000166176,갈비탕,보관,갈비탕은 솔가 원으로 자주 찾을 것 같아요. 냉동실에 보관해두면 편리합니다.
1000166176,갈비탕,양,양이 적은 분들에게는 2인분으로도 충분한 양입니다.
1000166176,갈비탕,포장/배송,"배송은 매우 빠르게 진행되었으며, 아이스팩으로 배송된 제품은 포장 상태가 깔끔했습니다. 새벽 배송으로 어제 저녁 10시에 도착하였고, 포장에는 다양한 정보가 표기되어 있었습니다."
1000175407,멸치 육수 300g 4개입,가격,"이 음식은 가격이 저렴하고, 비슷한 제품보다 더 저렴한 편입니다."
1000175407,멸치 육수 300g 4개입,맛/향/풍미,"원래 맛있는 라면에 고급 진 라면이되었습니다. 맛은 깊은 멸치 맛과 담백한 맛이 조화되어 풍부한 멸치 향이 입맛을 돋구어 주며, 감칠맛과 시원함이 극대화되어 만족스럽습니다."
1000175407,멸치 육수 300g 4개입,보관,이 제품은 오랜 시간 외출 후에도 열에 저항하여 녹지 않으며 냉동 보관이 가능합니다.
1000175407,멸치 육수 300g 4개입,양,"제품은 4팩에 넉넉한 양을 제공하지만, 실제로 500ml로 표시된 제품은 450ml로 포장되어 있습니다. 한 번에 사용하기 좋은 양이 담겨 있어 편리한 묵사발 키트입니다."
1000175407,멸치 육수 300g 4개입,포장/배송,"포장 상태는 꼼꼼하고 깔끔했으며, 드라이아이스가 녹지 않고 냉동된 상태로 잘 도착했습니다. 또한, 패키지는 깔끔하고 유통기한이 표기된 육수 팩이 제공되었습니다."
1000175407,백합 육수 300g 4개입,가격,제품은 가격이 저렴하고 만족스러운 성능을 제공해 재구매 의사가 생기는 제품입니다.
1000175407,백합 육수 300g 4개입,맛/향/풍미,"백합 육수는 시원하고 맛있는 맛을 제공하며, 간이 적당하여 간편하게 즐길 수 있습니다. 깔끔한 맛과 고급진 느낌이 함께하는 이 육수는 따로 조미료를 사용하지 않아도 감칠맛을 느낄 수 있습니다."
1000175407,백합 육수 300g 4개입,보관,육수는 급속 냉동으로 냉동실에 보관하면 안전하고 편리하게 저장할 수 있습니다.
1000175407,백합 육수 300g 4개입,포장/배송,포장 상태가 깔끔하고 배송도 빠릅니다. 300미리씩 포장되어 있어 1인분으로 사용하기 편리합니다.
1000175407,양지 육수 300g 4개입,가격,소고기 몇 만 원치 들어간 맛이 마음에 들며 4 팩이 들어 있어 가격과 맛이 합리적입니다.
1000175407,양지 육수 300g 4개입,맛/향/풍미,"가온 양지 육수는 진한 국물 맛을 담은 육수 베이스로, 소고기가 듬뿍 들어간 맛을 낼 수 있습니다."
1000175407,양지 육수 300g 4개입,보관,"이 제품은 쟁여 놔야하는 제품으로, 종류별로 냉동고에 재워두면 깔끔하고 편리합니다. 다만, 냉동으로 인해 휴대성이 떨어집니다."
1000175407,양지 육수 300g 4개입,양,"제품은 4팩씩 소분되어 있어 아이들이 먹기 적합하고, 자취생에게도 필요한 양이 적절합니다. 제품은 육수 4팩씩 들어있으며, 소고기 국이 마침 떨어졌을 때 구매한 제품입니다."
1000378706,사골곰탕 500g*10개입,가격,10개 구성에 가격이 합리적이었던 만큼 구입했습니다. 다이어트 음식은 세일과 만원 쿠폰으로 저렴하게 구입했습니다.
1000378706,사골곰탕 500g*10개입,맛/향/풍미,"이 상품은 진하고 짜서 물을 넣어야하는 정도의 맛이 있으며, 감칠맛이 나고 맛있어 간을 할 필요가 거의 없을 정도입니다. 또한, 간이 미리 되어 있어 싱겁게 먹는 입장에서 약간 짜지만 푹 고아진 맛이 좋으며 칼로리가 적어 기본 베이스로 사용하기 적합합니다."
1000378706,사골곰탕 500g*10개입,보관,"사골 곰탕은 쟁여두기 편리하고, 상온 보관이 가능합니다."
1000157414,한우 양해장국,가격,이 제품은 가성비가 좋은 중앙 해장과 비슷한 맛을 가지고 있습니다. 하지만 만들기 과정에 대한 불신으로 인해 재구매를 하지 않을 것 같습니다.
1000157414,한우 양해장국,맛/향/풍미,"중앙 해장국의 맛은 매콤하고 알싸하며 쫄깃쫄깃한 식감이 특징입니다. 하지만 깜놀 매장과는 다른 맛을 가지고 있으며, 신선한 재료로 만들어야 합니다."
1000157414,한우 양해장국,보관,"냉동 제품은 보관이 편리하지만, 맛이 떨어집니다. 냉장 제품을 먹는 것이 더 맛이 좋습니다."
1000157414,한우 양해장국,양,양이 풍부한 음식은 맛이 별로였습니다. 내용을 충분히 담아내지 못한 것 같았습니다.
1000157414,한우 양해장국,포장/배송,포장은 만족스럽게 왔으며 가격도 적절했습니다. 배송 또한 문제가 없었습니다.
1000136406,한우 냉이 된장찌개,맛/향/풍미,냉이 된장찌개는 맛과 양념의 깔끔함을 동시에 만족스럽게 제공하는 제품입니다. 한우가 듬뿍 들어 있어 맛을 돋우고 냉이 향이 진하여 기대에 부합하는 좋은 제품입니다.
1000136406,한우 냉이 된장찌개,보관,"이 제품은 고객이 몇 개 더 구매할 것임을 밝히며, 할머니를 위해 된장찌개용으로 사용할 것임을 알려주셨습니다."
1000136406,한우 냉이 된장찌개,양,"양은 적당했지만 양이 조금 적고, 냉이는 많았지만 적당했다."
1000136406,한우 냉이 된장찌개,포장/배송,제품에 초록색 철 실이 발견되어 믿을 수 없는 제조 공장으로 보이는 의견이 있습니다.
5074117,미역오이냉국,가격,"지난 몇 년 동안 컬리 제품을 사용한 결과, 체중이 50kg에서 63kg으로 증가했습니다. 그러나 비싼 제품으로 인해 재구매 의사가 없게되었습니다."
5074117,미역오이냉국,맛/향/풍미,맛은 괜찮지만 맛이 시다는 점이 있습니다.
5074117,미역오이냉국,보관,이 제품은 냉장고에 보관하는 것이 좋습니다.
5074117,미역오이냉국,양,"양은 2인분 정도로 적당한 양이며, 한 번 먹기에 적당한 양입니다."
5115298,양구 시래기 된장국,맛/향/풍미,이 음식은 겨울에 특히 맛이 좋아 담백한 맛을 좋아하는 분들에게 적합합니다. 시래기가 부드럽고 국물이 구수한 담백한 맛을 제공합니다.
5115298,양구 시래기 된장국,양,"양이 적당하고, 시래기 상태는 좋지 않지만 양이 풍부합니다."
5115298,양구 시래기 된장국,포장/배송,"상품은 시래기, 흙, 돌, 먼지 등으로 인한 문제가 있었습니다. 그러나 신속하고 정확한 배송과 깨끗한 포장으로 고객들은 편안했습니다."
5068792,착한들 한우사골곰탕 기획세트,가격,이 제품은 할인된 가격으로 구매할 수 있어서 좋았습니다. 기획 세트로 구매한 결과 가격대에 비해 가성비가 좋은 제품이었습니다.
5068792,착한들 한우사골곰탕 기획세트,맛/향/풍미,"진한 국물이 진하고 맛있으며, 첨가물이 적고 소금 간이 미리되어 있어 각자 기호에 맞게 먹을 수 있어요. 국물이 뽀얗고 냄새도 없으며, 맛도 깔끔하고 곰탕 맛을 잘 느낄 수 있어요."
5068792,착한들 한우사골곰탕 기획세트,보관,"이 제품은 냉동하지 않아 좋고, 냉장고에 보관하면 먹기 편합니다."
5068792,착한들 한우사골곰탕 기획세트,양,한우 사골 100은 찰싹한 국물과 함께 넉넉한 용량을 제공하는 좋은 제품입니다. 그러나 일부 고기가 포함되어 있지만 아쉬운 점이 있습니다.
1000620989,토종닭 백숙 삼계탕,가격,"이 제품은 여름 최고의 제품으로 간주되며, 국산으로서 만족스러운 구매를 했습니다."
1000620989,토종닭 백숙 삼계탕,맛/향/풍미,토종 닭으로 만든 삼계탕은 쫀득한 살과 진한 국물로 맛이 깔끔합니다. 국내산 재료로 만든 이 삼계탕은 쫄깃한 고기와 진한 국물로 맛있고 건강해지는 기분을 전해줍니다.
1000620989,토종닭 백숙 삼계탕,보관,"복날에 냉동 제품을 구입하고 싶습니다. 냉동 보관이 잘 되는 제품을 쟁여두고 싶은데, 냉장고에 넣어두면 오래 걸리니 참고해 주세요."
1000620989,토종닭 백숙 삼계탕,양,그것은 물이 충분히 있어요.
1000620989,토종닭 백숙 삼계탕,포장/배송,포장 상태가 마음에 들지 않았습니다. 냉동 포장에 드라이아이스가 많아져서 녹아버렸습니다.
5067835,찹쌀 순대국,가격,이 제품의 가격 대비 품질이 저렴한 편이었고 비슷한 제품보다 더 저렴하게 구입할 수 있었습니다.
5067835,찹쌀 순대국,맛/향/풍미,청양고추 새우젓 부추 무침을 넣은 해장국은 기대 이상의 맛과 진한 국물로 맛있었습니다. 끓이는 동안 살짝 나는 냄새를 보완하여 깔끔한 맛과 잡내가 없이 먹을 수 있습니다.
5067835,찹쌀 순대국,보관,"이 국물은 냉동하기 어렵지만, 떨어지면 항상 다시 구매하는 인기 국물입니다."
5067835,찹쌀 순대국,양,"본문은 건더기가 많고 내용물도 풍부하지만, 내용물의 질이 떨어지는 단점이 있습니다."
5067835,찹쌀 순대국,포장/배송,"냉동 제품이 찢어져서 국물이 흘러서 먹을 수 없게 되고, 포장지 파손으로 물에 젖거나 돼지 털이 박혀있는 문제가 있습니다."
5097090,맑은 곰탕,맛/향/풍미,"갈비탕은 가족들과 함께 먹은 후 맛있었습니다. 국물이 담백하고 깔끔한 맛과 부드러운 고기, 적절한 간이 좋았습니다."
5097090,맑은 곰탕,보관,"제품은 냉장고에 넣어두면 편리하고, 냄비에 끓여 먹을 수 있습니다. 냉동실에 넣어두면 23일 정도 보관할 수 있으며, 급할 때 조리하여 먹을 수 있습니다."
5097090,맑은 곰탕,양,"한 끼 한 사람을 위한 양이면 두 끼에 이은 양으로 제공되며, 국물과 고기가 충분히 들어 있어요."
5097090,맑은 곰탕,포장/배송,고객은 냉동식품을 배송 받았을 때 냉동식품이 녹아버리는 문제와 불편한 포장 상태를 경험했습니다.
5110442,야채담은 소불고기 400g (냉동),가격,"이 제품은 첫 구매 후 재구매 의사가 있지만, 할인 때만 구매합니다."
5110442,야채담은 소불고기 400g (냉동),맛/향/풍미,"이 상품은 맛이 좋아서 먹기 좋고, 국물이 맛있으며 양념이 특이한 맛이 있어 좋습니다."
5110442,야채담은 소불고기 400g (냉동),보관,"이 제품은 냉동 후 바로 먹는 것이 좋으며, 냉동 후 하루 전에 냉장실로 옮겨서 먹는 방법도 있습니다."
5110442,야채담은 소불고기 400g (냉동),양,당면은 양이 적지 않으며 고기는 얇지만 국물이 충분하여 맛있게 먹을 수 있습니다.
5055553,콩비지찌개,맛/향/풍미,"저는 국내산 장단콩에 간 돼지고기 우거지를 넣은 콩탕을 구입하여 먹었는데 맛있었습니다. 특히 고소한 맛이 강했으며, 신랑도 맛있다고 혼자 다 먹었답니다."
5055553,콩비지찌개,보관,"이 제품은 자주 사용하는 제품이며, 입맛이 없을 때 미리 준비하는 것이 좋습니다. 제품을 보관할 때 사놓고 급할 때 써도 좋습니다."
5055553,콩비지찌개,양,"500g의 양은 두 명이 함께 먹기 적절한 크기로, 한 명이 한 번에 먹기에는 조금 많은 크기입니다. 포만감이 좋고 배추도 충분히 들어있어 만족스럽습니다."
5055553,콩비지찌개,포장/배송,제품은 포장 상태와 위생 문제가 있어 보였습니다. 하지만 냉동 포장으로 배송된 제품은 드라이아이스를 넣어 보관하면 온도 유지되었습니다.
5128143,육개장,가격,"9800원짜리 대 파국을 구입했습니다. 기름이 많아 앞으로 구매할지는 불확실하고 가성비는 좋았지만 고기 잡내가 싫어하는 분들은 사지 말고, 가격은 오르었습니다."
5128143,육개장,맛/향/풍미,"육개장은 시원하고 얼큰한 국물 맛을 제공하며, 대파가 달달하고 매콤합니다. 기름이 많아 일부 고객은 먹기 어려울 수 있지만, 맛이 무난한 고객도 있습니다."
5128143,육개장,보관,이 제품은 조리하기 간편하고 냉동실에 잘 보관할 수 있습니다.
5128143,육개장,양,"750g의 넉넉한 양으로 부부가 한 그릇 정도 남았으며, 부드러운 양지와 고사리가 많았습니다. 하지만, 고기 조각이 없고 건더기는 생각보다 많았지만 맛있었습니다."
5128143,육개장,포장/배송,배송 받은 국은 포장지와 비닐이 찢어져 있고 플라스틱 이물질이 발견되었습니다. 또한 벌레가 들어 있는 문제로 음식의 신뢰성이 훼손되었습니다.
5058878,프리미엄 어묵탕,가격,어묵탕을 시음한 후 맛있게 먹었습니다.
5058878,프리미엄 어묵탕,맛/향/풍미,"어묵은 탱탱하고 쫀득쫀득하며 씹는 맛이 좋으며, 건강한 프리미엄으로 아이들에게도 안전하게 먹일 수 있습니다. 다양한 모양과 맛으로 재미있게 먹을 수 있지만, 국물과 어묵의 맛이 거의 같아 아쉬운 점이 있습니다."
5058878,프리미엄 어묵탕,보관,겨울 동안 여러 번 먹을 수 있는 어묵을 세일 때 구매하여 보관하는 것이 좋습니다. 보관 기간은 보통 2주 정도로 재구매를 자주하는 이유입니다.
5058878,프리미엄 어묵탕,양,"어묵을 좋아하는 고객은 두 번째 구매를 하면서 국물 양을 더 많이 잡아 2인분으로 푸짐하게 3번 이상 먹었고, 당파와 무를 넣어 시원한 국물이 되었다고 합니다. 1팩의 양은 450g로 두 사람이 먹을 만큼 충분하며, 다양한 종류의 어묵과 건더기 스프가 들어있다고 합니다."
5058878,프리미엄 어묵탕,포장/배송,이 식품 배달 서비스는 패키징이 만족스럽습니다.
5034225,명월관 갈비탕,가격,제품의 가격이 예상보다 비싼 것을 보고 실망했습니다.
5034225,명월관 갈비탕,맛/향/풍미,"이 제품은 국물이 깔끔하고 맛있지만 갈비가 부족하고, 고기는 부드럽지만 기름기가 많아 냄새가 나서 만족스럽지 않습니다."
5034225,명월관 갈비탕,보관,냉동 보관이 가장 맛이 비슷한 갈비탕은 음식점에서 나온 갈비탕입니다. 처음 먹기 위해 냉동 갈비탕을 사용할 때는 고기에 붙은 기름을 제거하고 충분히 해동한 후 끓여야 합니다.
5034225,명월관 갈비탕,양,"양이 하나당 15인분이면 두 개 조리하면 3인분 정도 되며, 1인분이나 2인분으로 조절할 수 있습니다. 국물과 고기는 1인분으로 적당하고, 갈비에 비계가 많아 먹을 게 없으며 갈빗대와 살코기가 들어 있는 냉동 상태의 고기는 센 불에서 팍팍 끓여서 퍽퍽해집니다."
5036959,곰탕,가격,가성비 좋은 곰탕으로 2공기 이상 나와 맛있으나 가격이 높아 만족스럽지 않지만 품질이 가치가 있다고 생각합니다.
5036959,곰탕,맛/향/풍미,"이 곰탕은 진하고 담백한 국물과 고소한 맛이 특징입니다. 기름기가 많아 느끼한 맛이 있으며, 다른 곰탕과는 차원이 다른 맛을 제공합니다."
5036959,곰탕,보관,"냉동 후 자연히 동시면 되며, 기운 없을 때 냉동실에 보관해두면 좋습니다. 기운이 없는 때 몸보신용으로 추천하는 거대 곰탕을 쟁여두세요."
5036959,곰탕,양,고기 양이 많고 우유처럼 찐한 국물에 양이 많아 한 끼로 드실 수 있는 음식입니다.
5036959,곰탕,포장/배송,"샛별 배송은 좋았지만, 용기 문제로 국물이 흘러서 문제가 발생했습니다."
5048745,감자탕,가격,"이 제품은 가격 대비 가성비가 나쁘게 느껴지지만, 다른 제품과 비교했을 때는 비슷한 수준의 품질을 제공하고 있음을 알 수 있습니다."
